Artist,Track
The Beatles,HES A REAL NOWHERE MANSITTING IN HIS NOWHERE LANDMAKING ALL HIS NOWHERE PLANS FOR NOBODYDOESNT HAVE A POINT OF VIEWKNOWS NOT WHERE HES GOING TOISNT HE A BIT LIKE YOU AND MENOWHERE MAN PLEASE LISTENYOU DONT KNOW WHAT YOURE MISSINGNOWHERE MAN THE WORLD IS AT YOUR COMMANDAH LA LA LA LAHES AS BLIND AS HE CAN BEJUST SEES WHAT HE WANTS TO SEENOWHERE MAN CAN YOU SEE ME AT ALLNOWHERE MAN DONT WORRYTAKE YOUR TIME NO HURRYLEAVE IT ALL TILL SOMEBODY ELSELENDS YOU A HANDAH LA LA LA LADOESNT HAVE A POINT OF VIEWKNOWS NOT WHERE HES GOING TOISNT HE A BIT LIKE YOU AND MENOWHERE MAN PLEASE LISTENYOU DONT KNOW WHAT YOURE MISSINGNOWHERE MAN THE WORLD IS AT YOUR COMMANDAH LA LA LA LAHES A REAL NOWHERE MANSITTING IN HIS NOWHERE LANDMAKING ALL HIS NOWHERE PLANS FOR NOBODYMAKING ALL HIS NOWHERE PLANS FOR NOBODYMAKING ALL HIS NOWHERE PLANS FOR NOBODY
The Beatles,WORDS ARE FLOWING OUT LIKE ENDLESS RAIN INTO A PAPER CUPTHEY SLITHER WILDLY AS THEY SLIP AWAY ACROSS THE UNIVERSEPOOLS OF SORROW WAVES OF JOY ARE DRIFTING THROUGH MY OPENED MINDPOSSESSING AND CARESSING MEJAI GURU DEVA OMNOTHINGS GONNA CHANGE MY WORLDNOTHINGS GONNA CHANGE MY WORLDNOTHINGS GONNA CHANGE MY WORLDNOTHINGS GONNA CHANGE MY WORLDIMAGES OF BROKEN LIGHT WHICH DANCE BEFORE ME LIKE A MILLION EYESTHEY CALL ME ON AND ON ACROSS THE UNIVERSETHOUGHTS MEANDER LIKE A RESTLESS WIND INSIDE A LETTER BOXTHEY TUMBLE BLINDLY AS THEY MAKE THEIR WAY ACROSS THE UNIVERSEJAI GURU DEVA OMNOTHINGS GONNA CHANGE MY WORLDNOTHINGS GONNA CHANGE MY WORLDNOTHINGS GONNA CHANGE MY WORLDNOTHINGS GONNA CHANGE MY WORLDSOUNDS OF LAUGHTER SHADES OF LIFE ARE RINGING THROUGH MY OPENED EARSINCITING AND INVITING MELIMITLESS UNDYING LOVE WHICH SHINES AROUND ME LIKE A MILLION SUNSAND CALLS ME ON AND ON ACROSS THE UNIVERSEJAI GURU DEVA OMNOTHINGS GONNA CHANGE MY WORLDNOTHINGS GONNA CHANGE MY WORLDNOTHINGS GONNA CHANGE MY WORLDNOTHINGS GONNA CHANGE MY WORLDJAI GURU DEVAJAI GURU DEVA
The Beatles,OH DARLINGPLEASE BELIEVE MEILL NEVER DO YOU NO HARMBELIEVE ME WHEN I TELL YOUILL NEVER DO YOU NO HARMOH DARLINGIF YOU LEAVE MEILL NEVER MAKE IT ALONEBELIEVE ME WHEN I BEG YOUDONT EVER LEAVE ME ALONEWHEN YOU TOLD MEYOU DIDNT NEED ME ANYMOREWELL YOU KNOW I NEARLYBROKE DOWN AND CRIEDWHEN YOU TOLD MEYOU DIDNT NEED ME ANYMOREWELL YOU KNOW I NEARLYBROKE DOWN AND DIEDOH DARLINGIF YOU LEAVE MEILL NEVER MAKE IT ALONEBELIEVE ME WHEN I TELL YOUILL NEVER DO YOU NO HARMBELIEVE ME DARLINGWHEN YOU TOLD MEYOU DIDNT NEED ME ANYMOREWELL YOU KNOW I NEARLYBROKE DOWN AND CRIEDWHEN YOU TOLD MEYOU DIDNT NEED ME ANYMOREWELL YOU KNOW I NEARLYBROKE DOWN AND DIEDOH DARLINGPLEASE BELIEVE MEILL NEVER LET YOU DOWNOH BELIEVE ME DARLINGBELIEVE ME WHEN I TELL YOUILL NEVER DO YOU NO HARM
The Beatles,PICTURE YOURSELF IN A BOAT ON A RIVERWITH TANGERINE TREES AND MARMALADE SKIESSOMEBODY CALLS YOU YOU ANSWER QUITE SLOWLYA GIRL WITH KALEIDOSCOPE EYESCELLOPHANE FLOWERS OF YELLOW AND GREENTOWERING OVER YOUR HEADLOOK FOR THE GIRL WITH THE SUN IN HER EYESAND SHES GONELUCY IN THE SKY WITH DIAMONDSLUCY IN THE SKY WITH DIAMONDSLUCY IN THE SKY WITH DIAMONDSAHHFOLLOW HER DOWN TO A BRIDGE BY A FOUNTAINWHERE ROCKING HORSE PEOPLE EAT MARSHMALLOW PIESEVERYONE SMILES AS YOU DRIFT PAST THE FLOWERSTHAT GROW SO INCREDIBLY HIGHNEWSPAPER TAXIS APPEAR ON THE SHOREWAITING TO TAKE YOU AWAYCLIMB IN THE BACK WITH YOUR HEAD IN THE CLOUDSAND YOURE GONELUCY IN THE SKY WITH DIAMONDSLUCY IN THE SKY WITH DIAMONDSLUCY IN THE SKY WITH DIAMONDSAHHPICTURE YOURSELF ON A TRAIN IN A STATIONWITH PLASTICINE PORTERS WITH LOOKING GLASS TIESSUDDENLY SOMEONE IS THERE AT THE TURNSTILETHE GIRL WITH KALEIDOSCOPE EYESLUCY IN THE SKY WITH DIAMONDSLUCY IN THE SKY WITH DIAMONDSLUCY IN THE SKY WITH DIAMONDSAHHLUCY IN THE SKY WITH DIAMONDSLUCY IN THE SKY WITH DIAMONDSLUCY IN THE SKY WITH DIAMONDSAHHLUCY IN THE SKY WITH DIAMONDSLUCY IN THE SKY WITH DIAMONDSLUCY IN THE SKY WITH DIAMONDSAHH
The Beatles,ID LIKE TO BE UNDER THE SEAIN AN OCTOPUSS GARDEN IN THE SHADEHED LET US IN KNOWS WHERE WEVE BEENIN HIS OCTOPUSS GARDEN IN THE SHADEID ASK MY FRIENDS TO COME AND SEEIN AN OCTOPUSS GARDEN WITH MEID LIKE TO BE UNDER THE SEAIN AN OCTOPUSS GARDEN IN THE SHADEWE WOULD BE WARM BELOW THE STORMIN OUR LITTLE HIDEAWAY BENEATH THE WAVESRESTING OUR HEAD ON THE SEA BEDIN AN OCTOPUSS GARDEN NEAR A CAVEWE WOULD SING AND DANCE AROUNDBECAUSE WE KNOW WE CANT BE FOUNDID LIKE TO BE UNDER THE SEAIN AN OCTOPUSS GARDEN IN THE SHADEWE WOULD SHOUT AND SWIM ABOUTTHE CORAL THAT LIES BENEATH THE WAVESOH WHAT JOY FOR EVERY GIRL AND BOYKNOWING THEYRE HAPPY AND THEYRE SAFEWE WOULD BE SO HAPPY YOU AND MENO ONE THERE TO TELL US WHAT TO DOID LIKE TO BE UNDER THE SEAIN AN OCTOPUSS GARDEN WITH YOUIN AN OCTOPUSS GARDEN WITH YOUIN AN OCTOPUSS GARDEN WITH YOU
The Beatles,LET ME TAKE YOU DOWN CAUSE IM GOING TOSTRAWBERRY FIELDSNOTHING IS REAL AND NOTHING TO GET HUNG ABOUTSTRAWBERRY FIELDS FOREVERLIVING IS EASY WITH EYES CLOSEDMISUNDERSTANDING ALL YOU SEEITS GETTING HARD TO BE SOMEONE BUT IT ALL WORKS OUTIT DOESNT MATTER MUCH TO MELET ME TAKE YOU DOWN CAUSE IM GOING TOSTRAWBERRY FIELDSNOTHING IS REAL AND NOTHING TO GET HUNG ABOUTSTRAWBERRY FIELDS FOREVERNO ONE I THINK IS IN MY TREEI MEAN IT MUST BE HIGH OR LOWTHAT IS YOU CANT YOU KNOW TUNE IN BUT ITS ALL RIGHTTHAT IS I THINK ITS NOT TOO BADLET ME TAKE YOU DOWN CAUSE IM GOING TOSTRAWBERRY FIELDSNOTHING IS REAL AND NOTHING TO GET HUNG ABOUTSTRAWBERRY FIELDS FOREVERALWAYS NO SOMETIMES THINK ITS MEBUT YOU KNOW I KNOW WHEN ITS A DREAMI THINK I KNOW I MEAN ER YES BUT ITS ALL WRONGTHAT IS I THINK I DISAGREELET ME TAKE YOU DOWN CAUSE IM GOING TOSTRAWBERRY FIELDSNOTHING IS REAL AND NOTHING TO GET HUNG ABOUTSTRAWBERRY FIELDS FOREVERSTRAWBERRY FIELDS FOREVERSTRAWBERRY FIELDS FOREVERCRANBERRY SAUCE
The Beatles,IF I FELL IN LOVE WITH YOUWOULD YOU PROMISE TO BE TRUEAND HELP ME UNDERSTANDCAUSE IVE BEEN IN LOVE BEFOREAND IVE FOUND THAT LOVE WAS MORETHAN JUST HOLDING HANDSIF I GIVE MY HEART TO YOUI MUST BE SURE FROM THE VERY STARTTHAT YOU WOULD LOVE ME MORE THAN HERIF I TRUST IN YOU OH PLEASEDONT RUN AND HIDEIF I LOVE YOU TOO OH PLEASEDONT HURT MY PRIDE LIKE HERCAUSE I COULDNT STAND THE PAINAND I WOULD BE SADIF OUR NEW LOVE WAS IN VAINSO I HOPE YOU SEE THAT IWOULD LOVE TO LOVE YOUAND THAT SHE WILL CRYWHEN SHE LEARNS WE ARE TWOCAUSE I COULDNT STAND THE PAINAND I WOULD BE SADIF OUR NEW LOVE WAS IN VAINSO I HOPE YOU SEE THAT IWOULD LOVE TO LOVE YOUAND THAT SHE WILL CRYWHEN SHE LEARNS WE ARE TWOIF I FELL IN LOVE WITH YOU
The Beatles,IN PENNY LANE THERE IS A BARBER SHOWING PHOTOGRAPHSOF EVERY HEAD HES HAD THE PLEASURE TO KNOWAND ALL THE PEOPLE THAT COME AND GOSTOP AND SAY HELLOON THE CORNER IS A BANKER WITH A MOTORCARTHE LITTLE CHILDREN LAUGH AT HIM BEHIND HIS BACKAND THE BANKER NEVER WEARS A MACIN THE POURING RAINVERY STRANGEPENNY LANE IS IN MY EARS AND IN MY EYESTHERE BENEATH THE BLUE SUBURBAN SKIESI SIT AND MEANWHILE BACKIN PENNY LANE THERE IS A FIREMAN WITH AN HOURGLASSAND IN HIS POCKET IS A PORTRAIT OF THE QUEENHE LIKES TO KEEP HIS FIRE ENGINE CLEANITS A CLEAN MACHINEPICCOLO TRUMPET SOLOPENNY LANE IS IN MY EARS AND IN MY EYESFOUR OF FISH AND FINGER PIESIN SUMMER MEANWHILE BACKBEHIND THE SHELTER IN THE MIDDLE OF A ROUNDABOUTA PRETTY NURSE IS SELLING POPPIES FROM A TRAYAND THOUGH SHE FEELS AS IF SHES IN A PLAYSHE IS ANYWAYIN PENNY LANE THE BARBER SHAVES ANOTHER CUSTOMERWE SEE THE BANKER SITTING WAITING FOR A TRIMAND THEN THE FIREMAN RUSHES INFROM THE POURING RAINVERY STRANGEPENNY LANE IS IN MY EARS AND IN MY EYESTHERE BENEATH THE BLUE SUBURBAN SKIESI SIT AND MEANWHILE BACKPENNY LANE IS IN MY EARS AND IN MY EYESTHERE BENEATH THE BLUE SUBURBAN SKIESPENNY LANE
The Beatles,IS THERE ANYBODY GOING TO LISTEN TO MY STORYALL ABOUT THE GIRL WHO CAME TO STAYSHES THE KIND OF GIRLYOU WANT SO MUCH IT MAKES YOU SORRYSTILL YOU DONT REGRET A SINGLE DAYAH GIRL GIRL GIRLWHEN I THINK OF ALL THE TIMESI TRIED TO HARD TO LEAVE HERSHE WILL TURN TO ME AND START TO CRYAND SHE PROMISES THE EARTH TO MEAND I BELIEVE HERAFTER ALL THIS TIME I DONT KNOW WHYAH GIRL GIRL GIRLSHES THE KIND OF GIRL WHO PUTS YOU DOWNWHEN FRIENDS ARE THEREYOU FEEL A FOOLWHEN YOU SAY SHES LOOKING GOODSHE ACTS AS IF ITS UNDERSTOODSHES COOL OOH OO OO OOGIRL GIRL GIRLWAS SHE TOLD WHEN SHE WAS YOUNGTHAT PAIN WOULD LEAD TO PLEASUREDID SHE UNDERSTAND IT WHEN THEY SAIDTHAT A MAN MUST BREAK HIS BACKTO EARN HIS DAY OF LEISUREWILL SHE STILL BELIEVE IT WHEN HES DEADAH GIRL GIRL GIRLGIRL
Gorillaz,HAHAHAHAHAHAHAFEEL GOOD SHAKE IT SHAKE IT SHAKE ITFEEL GOOD SHAKE IT SHAKE IT SHAKE ITFEEL GOOD SHAKE IT SHAKE IT SHAKE ITFEEL GOOD SHAKE IT SHAKE IT SHAKE ITFEEL GOOD SHAKE IT SHAKE IT SHAKE ITFEEL GOOD SHAKE IT SHAKE IT SHAKE ITFEEL GOOD SHAKE IT SHAKE IT SHAKE ITFEEL GOOD SHAKE IT SHAKE IT SHAKE ITCITYS BREAKING DOWN ON A CAMELS BACKTHEY JUST HAVE TO GO CAUSE THEY DONT KNOW WACKSO ALL YOU FILL THE STREETS ITS APPEALING TO SEEYOU WONT GET OUT THE COUNTY COS YOURE BAD AND FREEYOUVE GOT A NEW HORIZON ITS EPHEMERAL STYLEA MELANCHOLY TOWN WHERE WE NEVER SMILEAND ALL I WANNA HEAR IS THE MESSAGE BEEPMY DREAMS THEYVE GOT TO KISS BECAUSE I DONT GET SLEEP NOWINDMILL WINDMILL FOR THE LANDTURN FOREVER HAND IN HANDTAKE IT ALL IN ON YOUR STRIDEIT IS SINKING FALLING DOWNLOVE FOREVER LOVE IS FREELETS TURN FOREVER YOU AND MEWINDMILL WINDMILL FOR THE LANDIS EVERYBODY INLAUGHING GAS THESE HAZMATS FAST CATSLINING THEM UPA LIKE ASS CRACKSLADIES HOMIES AT THE TRACKITS MY CHOCOLATE ATTACKSHIT IM STEPPING IN THE HEART OF THIS HERECARE BEAR BUMPIN IN THE HEART OF THIS HEREWATCH ME AS I GRAVITATEHAHAHAHAHAHAAYO WE GOIN GO GHOST TOWNTHIS MOTOWNWITH YO SOUND YOU IN THE BLINKGOING TO BITE THE DUSTCANT FIGHT WITH USWITH YO SOUNDYOU KILL THE INCSO DONT STOP GET IT GET ITUNTIL YOU JET AHEADAND WATCH THE WAY I NAVIGATEHAHAHAHAHHAHAHAHWINDMILL WINDMILL FOR THE LANDTURN FOREVER HAND IN HANDTAKE IT ALL IN ON YOUR STRIDEIT IS SINKING FALLING DOWNLOVE FOREVER LOVE IS FREELETS TURN FOREVER YOU AND MEWINDMILL WINDMILL FOR THE LANDIS EVERYBODY INDONT STOP GET IT GET ITWE ARE YOUR CAPTAINS IN ITFEEL GOOD STEADYWATCH ME NAVIGATEAHAHAHAHAHHAAFEEL GOODDONT STOP GET IT GET ITWE ARE YOUR CAPTAINS IN ITFEEL GOOD STEADYWATCH ME NAVIGATEAHAHAHAHAHHAAFEEL GOODSHSHAKE IT SHAKE ITFEEL GOODSHSHAKE IT SHAKE ITFEEL GOODSHSHAKE IT SHAKE ITFEEL GOODSHSHAKE IT SHAKE ITFEEL GOODAHAHAHAHAHAHAHAHAHA
Gorillaz,IM A SCARY GARGOYLE ON A TOWERTHAT YOU MADE WITH PLASTIC POWERYOUR RHINESTONE EYES ARE LIKE FACTORIES FAR AWAYWHERE THE PARALYTIC DREAMS THAT WE ALL SEEM TO KEEPDRIVE ON ENGINES TILL THEY WEEPWITH FUTURE PIXELS IN FACTORIES FAR AWAYSO CALL THE MAINLAND FROM THE BEACHYOUR HEART IS NOW WASHED UP IN BLEACHTHE WAVES ARE RISING FOR THIS TIME OF YEARAND NOBODY KNOWS WHAT TO DO WITH THE HEATUNDER SUNSHINE PYLONS WELL MEETWHILE RAIN IS FALLING LIKE RHINESTONES FROM THE SKYUHMMMMMI CANT SEE YOU NOW MY HEART IS FROZENALL THE BOWSES AND THE GROWSESHAVE BEEN ABSTINATED IN MY SOULI PRAYED ON THE IMMOVABLEYET CLINGING TO THE ATOMS OF ROCKSEASONS SEE ADJUSTMENT SIGNS OF CHANGEI CANT SEE NOW SHE SAID TAXINOW THAT LIGHT IS ALL I CAN TAKETHIS DAWN BRINGS STRANGE LOYALTIES AND SKIESIM A SCARY GARGOYLE ON A TOWERTHAT YOU MADE WITH PLASTIC POWERYOUR RHINESTONE EYES ARE LIKE FACTORIES FAR AWAYHERE WE GO AGAINTHATS ELECTRICUHTHATS ELECTRICHELICOPTERS FLY OVER THE BEACHSAME TIME EVERY DAY SAME ROUTINEA CLEAR TARGET IN THE SUMMER WHEN SKIES ARE BLUEITS PART OF THE NOISE WHEN WINTER COMESIT REVERBERATES IN MY LUNGSNATURES CORRUPTED IN FACTORIES FAR AWAYHERE WE GO AGAINTHATS ELECTRICYOUR LOVES LIKE RHINESTONES FALLING FROM THE SKY UHTHATS ELECTRICWITH FUTURE PIXELS IN FACTORIES FAR AWAYHERE WE GO AGAINTHATS ELECTRICYOUR LOVES LIKE RHINESTONES FALLING FROM THE SKY UHTHATS ELECTRICWITH FUTURE PIXELS IN FACTORIES FAR AWAYHERE WE GO AGAIN
Gorillaz,HOOHOOHOOHOOHOOI AINT HAPPY IM FEELING GLADI GOT SUNSHINE IN A BAGIM USELESS BUT NOT FOR LONGTHE FUTURE IS COMING ONI AINT HAPPY IM FEELING GLADI GOT SUNSHINE IN A BAGIM USELESS BUT NOT FOR LONGTHE FUTURE IS COMING ONITS COMING ON ITS COMING ONITS COMING ON ITS COMING ONDEL THA FUNKY HOMOSAPIENFINALLY SOMEONE LET ME OUT OF MY CAGENOW TIME FOR ME IS NOTHING CAUSE IM COUNTIN NO AGENAH I COULDNT BE THERE NOW YOU SHOULDNT BE SCAREDIM GOOD AT REPAIRS AND IM UNDER EACH SNAREINTANGIBLE BET YOU DIDNT THINK SO I COMMAND YOU TOPANORAMIC VIEW LOOK ILL MAKE IT ALL MANAGEABLEPICK AND CHOOSE SIT AND LOSE ALL YOU DIFFERENT CREWSCHICKS AND DUDES WHO YOU THINK IS REALLY KICKIN TUNESPICTURE YOU GETTING DOWN IN A PICTURE TUBELIKE YOU LIT THE FUSE YOU THINK ITS FICTIONALMYSTICAL MAYBE SPIRITUAL HEROWHO APPEARS IN YOU TO CLEAR YOUR VIEW WHEN YOURE TOO CRAZYLIFELESS TO THOSE THE DEFINITION FOR WHAT LIFE ISPRICELESS TO YOU BECAUSE I PUT YOU ON THE HYPE SHITYOU LIKE IT GUN SMOKIN RIGHTEOUS WITH ONE TOKEGET PSYCHIC AMONG THOSE POSSESS YOU WITH ONE DOSED DEL THA FUNKY HOMOSAPIENI AINT HAPPY IM FEELING GLADI GOT SUNSHINE IN A BAGIM USELESS BUT NOT FOR LONGTHE FUTURE IS COMING ONI AINT HAPPY IM FEELING GLADI GOT SUNSHINE IN A BAGIM USELESS BUT NOT FOR LONGTHE FUTURE IS COMING ON THATS RIGHTITS COMING ON ITS COMING ONITS COMING ON ITS COMING ONDEL THA FUNKY HOMOSAPIENTHE ESSENCE THE BASICS WITHOUT IT YOU MAKE ITALLOW ME TO MAKE THIS CHILDLIKE IN NATURERHYTHM YOU HAVE IT OR YOU DONT THATS A FALLACYIM IN THEM EVERY SPROUTIN TREE EVERY CHILD OF PEACEEVERY CLOUD AND SEA YOU SEE WITH YOUR EYESI SEE DESTRUCTION AND DEMISE CORRUPTION IN DISGUISE THATS RIGHTFROM THIS FUCKIN ENTERPRISE NOW IM SUCKED INTO YOUR LIESTHROUGH RUSSEL NOT HIS MUSCLESBUT PERCUSSION HE PROVIDES FOR ME AS A GUIDE YALL CAN SEE ME NOWCAUSE YOU DONT SEE WITH YOUR EYE YOU PERCEIVE WITH YOUR MINDTHATS THE INNER FUCK EM SO IMA STICK AROUND WITH RUSS AND BE A MENTORBUST A FEW RHYMES SO MOTHERFUCKERS REMEMBERWHERE THE THOUGHT IS I BROUGHT ALL THISSO YOU CAN SURVIVE WHEN LAW IS LAWLESS RIGHT HEREFEELINGS SENSATIONS THAT YOU THOUGHT WAS DEADNO SQUEALING AND REMEMBER THAT ITS ALL IN YOUR HEADI AINT HAPPY IM FEELING GLADI GOT SUNSHINE IN A BAGIM USELESS BUT NOT FOR LONGTHE FUTURE IS COMING ONI AINT HAPPY IM FEELING GLADI GOT SUNSHINE IN A BAGIM USELESS BUT NOT FOR LONGMY FUTURE IS COMING ONITS COMING ON ITS COMING ONITS COMING ON ITS COMING ONMY FUTURE IS COMING ONITS COMING ON ITS COMING ONITS COMING ON ITS COMING ONMY FUTURE IS COMING ONITS COMING ON ITS COMING ONITS COMING ON ITS COMING ONMY FUTURE IS COMING ONITS COMING ON ITS COMING ONMY FUTURE IS COMING ONITS COMING ON ITS COMING ONMY FUTURE IS COMING ONITS COMING ON ITS COMING ONMY FUTURE
Gorillaz,ITS COMING UP ITS COMING UPITS COMING UP ITS COMING UPITS COMING UP ITS COMING UPITS DARE UHITS DAREYOUVE GOT TO PRESS IT ON YOUYOUVE JUST BEEN THINKINGTHATS WHAT YOU DO BABYHOLD IT DOWN THEREJUMP WITH THEM ALL AND MOVE ITJUMP BACK AND FORTHAND FEEL LIKE YOU WERE THERE YOURSELFWORK IT OUTNEVER DID NO HARM NEVER DID NO HARMITS DAREITS COMING UP ITS COMING UPITS COMING UP ITS COMING UPITS COMING UPITS DARE UHYOUVE GOT TO PRESS IT ON YOUYOUVE JUST BEEN THINKINGTHATS WHAT YOU DO BABYHOLD IT DOWN THEREJUMP WITH THEM ALL AND MOVE ITJUMP BACK AND FORTHAND FEEL LIKE YOU WERE THERE YOURSELFWORK IT OUTNEVER DID NO HARM NEVER DID NO HARMITS DAREITS COMING UP ITS COMING UPITS COMING UP ITS COMING UPITS COMING UPITS DARENEVER DID NO HARM NEVER DID NO HARMITS DAREITS COMING UP ITS COMING UPITS COMING UP ITS COMING UPITS COMING UPITS DARE UHYOUVE GOT TO PRESS IT ON YOUYOUVE JUST BEEN THINKINGTHATS WHAT YOU DO BABYHOLD IT DOWN THEREJUMP WITH THEM ALL AND MOVE ITJUMP BACK AND FORTHAND FEEL LIKE YOU WERE THERE YOURSELFWORK IT OUTYOUVE GOT TO PRESS IT ON YOUYOUVE JUST BEEN THINKINGTHATS WHAT YOU DO BABYHOLD IT DOWN THEREJUMP WITH THEM ALL AND MOVE ITJUMP BACK AND FORTHAND FEEL LIKE YOU WERE THERE YOURSELFWORK IT OUT
Gorillaz,DUP ON MELANCHOLY HILL THERES A PLASTIC TREEARE YOU HERE WITH MEJUST LOOKING OUT ON THE DAY OF ANOTHER DREAMWHERE YOU CANT GET WHAT YOU WANT BUT YOU CAN GET MESO LETS SET OUT TO SEA LOVECAUSE YOU ARE MY MEDICINE WHEN YOURE CLOSE TO MEWHEN YOURE CLOSE TO MEDSO CALL IN THE SUBMARINES ROUND THE WORLD WELL GODOES ANYBODY KNOW LOVEIF WERE LOOKING OUT ON THE DAY OF ANOTHER DREAMIF YOU CANT GET WHAT YOU WANT THEN YOU COME WITH MEUP ON MELANCHOLY HILLSITS THE MANATEE LOVEJUST LOOKING OUT FOR THE DAY WHEN YOURE CLOSE TO MEWHEN YOURE CLOSE TO MEWHEN YOURE CLOSE TO ME
Gorillaz,I NEED A GUN TO KEEP MYSELF AMONGTHE POOR PEOPLE WHO ARE BURNING IN THE SUNBUT THEY AINT GOT A CHANCE THEY AINT GOT A CHANCEI NEED A GUN CAUSE ALL I DO IS DANCECAUSE ALL I DO IS DANCEI NEED A GUN TO KEEP MYSELF AMONGTHE POOR PEOPLE WHO ARE BURNING IN THE SUNBUT THEY AINT GOT A CHANCE THEY AINT GOT A CHANCEI NEED A GUN CAUSE ALL I DO IS DANCECAUSE ALL I DO IS DANCEIN MY BACKPACK I GOT MY ACT RIGHT IN CASE YOU ACT QUITE DIFFICULTAND YOUR RESULT WEAKENWITH ANGER AND DISCONTENT SOME ARE SEEKINGIN SEARCH OF LIKE NIMOYIM A PEACELOVING DECOY READY FOR RETALIATIONI CHANGE YOUR WHOLE LOCATION TO A PINE BOX SIX UNDERIMPULSIVE DONT ASK WHY OR WONDERORDERS GIVEN TO ME IS STRIKE AND IM THUNDERWITH LIGHTNINGFAST REFLEXESON CONSTANT ALERT FROM THE CONSTANT HURTTHAT SEEMS LIMITLESS WITH NO DROP IN PRESSUREIT SEEMS LIKE EVERYBODYS OUT TO TEST YA TIL THEY SEE YOU BREAKYOU CANT CONCEAL THE HATE THAT CONSUMES YOUIM THE REASON WHY YOU FILL UP YOUR ISUZUCHILL WITH YOUR OLD LADY AT THE TILTI GOT A NINETYDAY EXTENSION AND IM FILLED WITH GUILTFROM THINGS THAT I SEENYOUR WATERS FROM A BOTTLE MINES FROM A CANTEENAT NIGHT I HEAR THE SHOTS RING SO IM A LIGHT SLEEPERTHE COST OF LIFE IT SEEMS TO GET CHEAPEROUT IN THE DESERT WITH MY STREET SWEEPERTHE WAR IS OVER SO SAID THE SPEAKERWITH THE FLIGHT SUIT ONMAYBE TO HIM IM JUST A PAWNSO HE CAN ADVANCEREMEMBER WHEN I USED TO DANCEMAN ALL I WANNA DO IS DANCEI NEED A GUN TO KEEP MYSELF AMONG
Gorillaz,KIDS WITH GUNSKIDS WITH GUNSTAKING OVERBUT THEY WONT BE LONGTHEYRE MESMERISEDSKELETONSKIDS WITH GUNSKIDS WITH GUNSEASY DOES IT EASY DOES ITTHEY GOT SOMETHING TO SAY NO TODRINKING OUT PUSH IT REALPACIFIER PUSH IT REAL PUSH ITVITAMIN SOULS PUSH IT PUSH IT REALTHE STREET DESIRE PUSH IT REAL PUSH ITDOESNT MAKE SENSE TO PUSH IT PUSH IT REALBUT IT WONT BE LONG PUSH IT REAL PUSH ITKIDS WITH GUNSKIDS WITH GUNSEASY DOES IT EASY DOES ITTHEY GOT SOMETHING TO SAY NO TONOW THEYRE TURNING US INTO MONSTERSTURNING US INTO FIRETURNING US INTO MONSTERSITS ALL DESIRE ITS ALL DESIRE ITS ALL DESIREDRINKING OUTPACIFIERSINKING SOULTHERE YOU AREDOESNT MAKE SENSE TOBUT IT WONT BE LONGCAUSE KIDS WITH GUNSKIDS WITH GUNSEASY DOES IT EASY DOES ITTHEY GOT SOMETHING TO SAY NO TONOW THEYRE TURNING US INTO MONSTERSTURNING US INTO FIRETURNING US INTO MONSTERSITS ALL DESIRE ITS ALL DESIRE ITS ALL DESIREPUSH IT PUSH IT REAL ITS REALPUSH IT REAL REALPUSH IT PUSH IT PUSH IT REAL ITS REAL REALPUSH IT REAL REALPUSH IT PUSH IT PUSH IT REAL ITS REALPUSH IT REAL REALPUSH IT PUSH IT PUSH IT REAL ITS REAL REALPUSH IT REAL ITS REALPUSH IT PUSH IT PUSH IT REAL ITS REAL REALPUSH IT REAL REALPUSH IT PUSH IT PUSH IT REAL ITS REAL REALPUSH IT REAL REALPUSH IT PUSH IT PUSH IT REAL ITS REAL REALPUSH IT REALPUSH IT PUSH IT PUSH IT REALI DONT KNOW WHAT IM GONNA DOOH OH OH OHAFTER DAY AFTER NIGHT COMEDONT DONT KILL ME NOWAFTER NIGHT COME DAYOH OH OHAFTER DAY AFTER NIGHT COMEDONT DONT KILL ME NOWOH OH OH OH
Gorillaz,O GREEN WORLDDONT DESERT ME NOWBRING ME BACK TO FALLEN TOWNWHERE SOMEONE IS STILL ALIVEFIGHTING FOR SOMETHING NEW IN THISWHEN NO ONE NEEDS THE HEART OF ME AND ILLGET OUT SOMEWHERE OTHER THAN ME BEFORETHAN ME BEFOREO GREEN WORLDDONT DESERVE ME NOWIM MADE OF YOU AND YOU OF MEBUT WHERE ARE WEOH NOSELLS TO LIEPHONE WITH TALK YOU STARSSUPPOSE YOUDOWN WHEN YOURE IN FASTCAUSE IT SEEMS SO LITTLE TO YOUBUT NOW YOURE IN LOVE YOU KNOWYOU KNOW ME TOOYOU KNOW ME TOOI HOPE SEX AND DRUGS RUST INTO MY SELF HOLYIT FEELS HOLYIT FEELS LIKE YOURE WITH YOUR FATHER IN THE PLACE YOU LOVE
Gorillaz,THE WORLD IS SPINNING TOO FASTIM BUYING LEAD NIKE SHOESTO KEEP MYSELF TETHEREDTO THE DAYS IVE TRIED TO LOSEMY MAMA SAID TO SLOW DOWNYOU MUST MAKE YOUR OWN SHOESSTOP DANCING TO THE MUSICOF GORILLAZ IN A HAPPY MOODKEEPING MY GROOVE ONTHEY DO THE BUMPTHEY DO THE BUMPTHEY DO THE BUMPYEAH YEAHTHEY DO THE BUMPTHEY DO THE BUMPTHEY DO THE BUMPTHEY DO THE BUMPHERE YOU GO GET THE COOLGET THE COOL SHOESHINEGET THE COOLGET THE COOL SHOESHINEGET THE COOLGET THE COOL SHOESHINEGET THE COOLGET THE COOL SHOESHINETHERES A MONKEY IN THE JUNGLEWATCHING A VAPOR TRAILCAUGHT UP IN THE CONFLICTBETWEEN ITS BRAIN AND ITS TAILAND IF TIMES ELIMINATIONTHEN WE GOT NOTHING TO LOSEPLEASE REPEAT THE MESSAGEITS THE MUSIC THAT WE CHOOSEKEEPING MY GROOVE ONTHEY DO THE BUMPTHEY DO THE BUMPTHEY DO THE BUMPYEAH YEAHTHEY DO THE BUMPTHEY DO THE BUMPTHEY DO THE BUMPTHEY DO THE BUMPOKAY BRING IT DOWN HEREWE GOIN BACK OUTGET THE COOLGET THE COOL SHOESHINEGET THE COOLGET THE COOL SHOESHINEGET THE COOLGET THE COOL SHOESHINEGET THE COOLGET THE COOL SHOESHINETHEY DO THE BUMPTHEY DO THE BUMPTHEY DO THE BUMPTHEY DO THE BUMP
Gorillaz,SUMMER DONT KNOW ME NO MOREHE GOT MAD TIRESOMESUMMER DONT KNOW MEHED JUST LET ME LOW IN MYSELFCAUSE I DO KNOW LOVEFROM YOU THENJUST DYINGI SAW THAT DAYLOST MY MINDLORD IM FINEMAYBE IN TIMEYOULL WANT TO BE MINEDONT STOP THE BUD WHEN IT COMESITS THE DAWN YOULL SEEMONEY WONT GET THERETEN YEARS PASSED TONIGHT YOULL FLEEIF YOU DO THATILL BE SWORNTO FIND YOUI SAW THAT DAYLOST MY MINDLORD IM FINEMAYBE IN TIMEYOULL WANT TO BE MINEI SAW THAT DAYLOST MY MINDLORD IM FINEMAYBE IN TIMEYOULL WANT TO BE MINEMAYBE IN TIMEYOULL WANT TO BE MINEMAYBE IN TIMEYOULL WANT TO BE MINEMAYBE IN TIMEYOULL WANT TO BE MINEMAYBE IN TIMEYOULL WANT TO BE MINE
Gorillaz,EVERYBODYS HERE WITH MEWEVE GOT NO CAMERA TO SEEDONT THINK IM ALL IN THIS WORLDTHE CAMERA WONT LET ME ROLLTHE VERDICT DOESNT LOVE OUR SOULTHE DIGITAL WONT LET ME GOYEAH YEAH YEAH ILL PAYWHEN TOMORROWTOMORROW COMES TODAYUNINTELLIGIBLESTEREO I WANT IT ONITS TAKEN ME FAR TOO LONGDONT THINK IM ALL IN THIS WORLDDONT THINK ILL BE HERE TOO LONGDONT THINK ILL BE HERE TOO LONGDONT THINK ILL BE HERE TOO LONGI DONT THINK ILL BE HERE TOO LONGI DONT THINK ILL BE HERE TOO LONGYEAH YEAH YEAH ILL PAYWHEN TOMORROWTOMORROW COMES TODAYDONT THINK IM NOT ALL IN THIS WORLDDONT THINK IM NOT ALL IN THIS WORLDDONT THINK IM NOT ALL IN THIS WORLDDONT THINK IM NOT ALL IN THIS WORLD
Gorillaz,DEL THE FUNKY HOMOSAPIENI KNOW YOU LIKE THAT YOU WANT TO TRY THATITS LIKE A FLASHBACK SO SHAKE YOUR ASS CRACKI GOT THE BALLS TO ROCK THE SALSAFUNK THE BLUESA ANY GROOVE TOMAKE YOUR MOVE CAUSE TAKING YOU TOANOTHER LANDSCAPE IS MY MANDATEIM HIGHLY ANIMATED EVEN THOUGH IM DECOMPOSINSO IF YOUR FEET IS FROZEN IMA DIE TO SEE YOU ROPINDEL THE FUNKY HOMOSAPIENAND WHEN THE MC RHYME AND THE DJ SPINI WANT YALL TO JUST GET DOWNNOW WHILE THE MC RHYMING AND THE DJ CUTTINGI WANT YALL TO JUST GET DOWNAND WHEN THE MC RHYME AND THE DJ SPINI WANT YALL TO JUST GET DOWNNOW WHILE THE MC RHYMING AND THE DJ CUTTINGI WANT YALL TO JUST GET DOWNDEL THE FUNKY HOMOSAPIENTAP YOUR TOES AND CLAP YOUR HANDSHOW MANY PEOPLE READY TO ROCK THE HOUSECOME ON TRACE THE GLOBE AND SHAKE YOUR PANTSHOW MANY PEOPLE READY TO ROCK THE HOUSEJUST TWIST YOUR HIP AND DO THE DIPHOW MANY PEOPLE READY TO ROCK THE HOUSECOME ON SHAKE AND BAKE DO WHATEVER IT TAKESHOW MANY PEOPLE READY TO ROCK THE HOUSEDEL THE FUNKY HOMOSAPIENGRAVITATIONAL PULLLL HAVE YOU MAKING A FOOLOUT OF YOURSELF ON THE DANCE FLOORDOING BACK SPINS RUNNING MAN AND MOREPARTY DOWN WITH VIGOR AND CANDORCOMING TO THE JAM OR LOOK LIKE A LANDLUBBERAND DO THE AQUA BOOGIE WIN LOTS OF GOODIES MAYBEPOP A GUCCI WALLET TURNTABLES IS TALKING TO MEITS AWFULLY GROOVY SEEING ALL THE TREASURE AND THE BOOTYDEL THE FUNKY HOMOSAPIENAND WHEN THE MC RHYME AND THE DJ SPINI WANT YALL TO JUST GET DOWNNOW WHILE THE MC RHYMING AND THE DJ CUTTINGI WANT YALL TO JUST GET DOWNAND WHEN THE MC RHYME AND THE DJ SPINI WANT YALL TO JUST GET DOWNNOW WHILE THE MC RHYMING AND THE DJ CUTTINGI WANT YALL TO JUST GET DOWNDEL THE FUNKY HOMOSAPIENTAP YOUR TOES AND CLAP YOUR HANDSHOW MANY PEOPLE READY TO ROCK THE HOUSECOME ON TRACE THE GLOBE AND SHAKE YOUR PANTSHOW MANY PEOPLE READY TO ROCK THE HOUSEJUST TWIST YOUR HIP AND DO THE DIPHOW MANY PEOPLE READY TO ROCK THE HOUSECOME ON SHAKE AND BAKE DO WHATEVER IT TAKESHOW MANY PEOPLE READY TO ROCK THE HOUSEDEL THE FUNKY HOMOSAPIENI WANT TO GET DOWN LOWER THAN ATLANTISGOING TOE TO TOE WITH AN ENCHANTRESSGET FUNKIER THAN FUNKADELIC WEARING PAMPERSWHILE YOU EGGHEADS IS ON THE WALL PREPARING ANSWERSSHARING TRANSCRIPTS WHILE WE OVER HEREDIPPING AND DANCING RHYTHM ROMANCINGWALLFLOWERS GIVING NO ACTION NOALL HOURS WE CHILLIN AND MAXINSO RELAXIN OPPOSITES ATTRACTINIMA TOSS MY HAT IN FLOSS WHEN THE TRACK SPINLIKE IM ON A CRACK BEND JIGGLIN AND WIGGLINFREAKING BOOTIES SPEAKING TO THE CUTIES SO BELLIGERENTNO RELIGION JUST BUMP THE FEED ONYOULL FEEL REBORN NEGATIVITY WE JUST DEAD IT LIKE DECOYBETTER LIFT YOUR FEET AND JUST MEASURE THE BEAT ONTHE PULSE WHEN IT RESPONDSDEL THE FUNKY HOMOSAPIENTAP YOUR TOES AND CLAP YOUR HANDSHOW MANY PEOPLE READY TO ROCK THE HOUSECOME ON TRACE THE GLOBE AND SHAKE YOUR PANTSHOW MANY PEOPLE READY TO ROCK THE HOUSEJUST TWIST YOUR HIP AND DO THE DIPHOW MANY PEOPLE READY TO ROCK THE HOUSECOME ON SHAKE AND BAKE DO WHATEVER IT TAKESHOW MANY PEOPLE READY TO ROCK THE HOUSE
