Artist,Track
Eminem,MAY I HAVE YOUR ATTENTION PLEASEMAY I HAVE YOUR ATTENTION PLEASEWILL THE REAL SLIM SHADY PLEASE STAND UPI REPEAT WILL THE REAL SLIM SHADY PLEASE STAND UPWERE GONNA HAVE A PROBLEM HEREYALL ACT LIKE YOU NEVER SEEN A WHITE PERSON BEFOREJAWS ALL ON THE FLOOR LIKE PAM LIKE TOMMY JUST BURST IN THE DOORAND STARTED WHOOPIN HER ASS WORSE THAN BEFORETHEY FIRST WERE DIVORCED SUIN HER OVER FURNITURE AGHITS THE RETURN OF THE OH WAIT NO WAY YOURE KIDDINGHE DIDNT JUST SAY WHAT I THINK HE DID DID HEAND DR DRE SAID NOTHING YOU IDIOTSDR DRES DEAD HES LOCKED IN MY BASEMENT HA HAFEMINIST WOMEN LOVE EMINEMCHICKA CHICKA CHICKA SLIM SHADY IM SICK OF HIMLOOK AT HIM WALKIN AROUND GRABBIN HIS YOUKNOWWHATFLIPPIN THE YOUKNOWWHO YEAH BUT HES SO CUTE THOUGHYEAH I PROBABLY GOT A COUPLE OF SCREWS UP IN MY HEAD LOOSEBUT NO WORSE THAN WHATS GOIN ON IN YOUR PARENTS BEDROOMSSOMETIMES I WANNA GET ON TV AND JUST LET LOOSEBUT CANT BUT ITS COOL FOR TOM GREEN TO HUMP A DEAD MOOSEMY BUM IS ON YOUR LIPS MY BUM IS ON YOUR LIPSAND IF IM LUCKY YOU MIGHT JUST GIVE IT A LITTLE KISSAND THATS THE MESSAGE THAT WE DELIVER TO LITTLE KIDSAND EXPECT THEM NOT TO KNOW WHAT A WOMANS CLITORIS ISOF COURSE THEYRE GONNA KNOW WHAT INTERCOURSE ISBY THE TIME THEY HIT FOURTH GRADETHEYVE GOT THE DISCOVERY CHANNEL DONT THEYWE AINT NOTHIN BUT MAMMALSWELL SOME OF US CANNIBALSWHO CUT OTHER PEOPLE OPEN LIKE CANTALOUPESBUT IF WE CAN HUMP DEAD ANIMALS AND ANTELOPESTHEN THERES NO REASON THAT A MAN AND ANOTHER MAN CANT ELOPEBUT IF YOU FEEL LIKE I FEEL I GOT THE ANTIDOTEWOMEN WAVE YOUR PANTYHOSE SING THE CHORUS AND IT GOESIM SLIM SHADY YES IM THE REAL SHADYALL YOU OTHER SLIM SHADYS ARE JUST IMITATINGSO WONT THE REAL SLIM SHADY PLEASE STAND UPPLEASE STAND UP PLEASE STAND UPCAUSE IM SLIM SHADY YES IM THE REAL SHADYALL YOU OTHER SLIM SHADYS ARE JUST IMITATINGSO WONT THE REAL SLIM SHADY PLEASE STAND UPPLEASE STAND UP PLEASE STAND UPWILL SMITH DONT GOTTA CUSS IN HIS RAPS TO SELL RECORDS NOPEWELL I DO SO FUCK HIM AND FUCK YOU TOOYOU THINK I GIVE A DAMN ABOUT A GRAMMYHALF OF YOU CRITICS CANT EVEN STOMACH ME LET ALONE STAND MEBUT SLIM WHAT IF YOU WIN WOULDNT IT BE WEIRDWHY SO YOU GUYS COULD JUST LIE TO GET ME HERESO YOU CAN SIT ME HERE NEXT TO BRITNEY SPEARSSHIT CHRISTINA AGUILERA BETTER SWITCH ME CHAIRSSO I CAN SIT NEXT TO CARSON DALY AND FRED DURSTAND HEAR EM ARGUE OVER WHO SHE GAVE HEAD TO FIRSTLITTLE BITCH PUT ME ON BLAST ON MTVYEAH HES CUTE BUT I THINK HES MARRIED TO KIM HEEHEEI SHOULD DOWNLOAD HER AUDIO ON MPAND SHOW THE WHOLE WORLD HOW YOU GAVE EMINEM VD AGHIM SICK OF YOU LITTLE GIRL AND BOY GROUPSALL YOU DO IS ANNOY ME SO I HAVE BEEN SENT HERE TO DESTROY YOUAND THERES A MILLION OF US JUST LIKE MEWHO CUSS LIKE ME WHO JUST DONT GIVE A FUCK LIKE MEWHO DRESS LIKE ME WALK TALK AND ACT LIKE MEAND JUST MIGHT BE THE NEXT BEST THING BUT NOT QUITE MECAUSE IM SLIM SHADY YES IM THE REAL SHADYALL YOU OTHER SLIM SHADYS ARE JUST IMITATINGSO WONT THE REAL SLIM SHADY PLEASE STAND UPPLEASE STAND UP PLEASE STAND UPCAUSE IM SLIM SHADY YES IM THE REAL SHADYALL YOU OTHER SLIM SHADYS ARE JUST IMITATINGSO WONT THE REAL SLIM SHADY PLEASE STAND UPPLEASE STAND UP PLEASE STAND UPIM LIKE A HEAD TRIP TO LISTEN TO CAUSE IM ONLY GIVIN YOUTHINGS YOU JOKE ABOUT WITH YOUR FRIENDS INSIDE YOUR LIVIN ROOMTHE ONLY DIFFERENCE IS I GOT THE BALLS TO SAY IT IN FRONT OF YALLAND I DONT GOTTA BE FALSE OR SUGARCOAT IT AT ALLI JUST GET ON THE MIC AND SPIT ITAND WHETHER YOU LIKE TO ADMIT IT I JUST SHIT ITBETTER THAN NINETY PERCENT OF YOU RAPPERS OUT CANTHEN YOU WONDER HOW CAN KIDS EAT UP THESE ALBUMS LIKE VALIUMSITS FUNNY CAUSE AT THE RATE IM GOING WHEN IM THIRTYILL BE THE ONLY PERSON IN THE NURSING HOME FLIRTINGPINCHING NURSES ASSES WHEN IM JACKING OFF WITH JERGENSAND IM JERKING BUT THIS WHOLE BAG OF VIAGRA ISNT WORKINGAND EVERY SINGLE PERSON IS A SLIM SHADY LURKINGHE COULD BE WORKING AT BURGER KING SPITTIN ON YOUR ONION RINGSOR IN THE PARKING LOT CIRCLING SCREAMING I DONT GIVE A FUCKWITH HIS WINDOWS DOWN AND HIS SYSTEM UPSO WILL THE REAL SHADY PLEASE STAND UPAND PUT ONE OF THOSE FINGERS ON EACH HAND UPAND BE PROUD TO BE OUTTA YOUR MIND AND OUTTA CONTROLAND ONE MORE TIME LOUD AS YOU CAN HOW DOES IT GOIM SLIM SHADY YES IM THE REAL SHADYALL YOU OTHER SLIM SHADYS ARE JUST IMITATINGSO WONT THE REAL SLIM SHADY PLEASE STAND UPPLEASE STAND UP PLEASE STAND UPCAUSE IM SLIM SHADY YES IM THE REAL SHADYALL YOU OTHER SLIM SHADYS ARE JUST IMITATINGSO WONT THE REAL SLIM SHADY PLEASE STAND UPPLEASE STAND UP PLEASE STAND UPCAUSE IM SLIM SHADY YES IM THE REAL SHADYALL YOU OTHER SLIM SHADYS ARE JUST IMITATINGSO WONT THE REAL SLIM SHADY PLEASE STAND UPPLEASE STAND UP PLEASE STAND UPCAUSE IM SLIM SHADY YES IM THE REAL SHADYALL YOU OTHER SLIM SHADYS ARE JUST IMITATINGSO WONT THE REAL SLIM SHADY PLEASE STAND UPPLEASE STAND UP PLEASE STAND UPHA HA I GUESS THERES A SLIM SHADY IN ALL OF USFUCK IT LETS ALL STAND UP
Eminem,HI MY NAME IS WHATMY NAME IS WHOMY NAME IS CHIKI CHIKI SLIM SHADYHI MY NAME IS HUHMY NAME IS WHATMY NAME IS CHIKI CHIKI SLIM SHADYAHEM EXCUSE MECAN I HAVE THE ATTENTION OF THE CLASSFOR ONE SECONDEMINEMHI KIDS DO YOU LIKE VIOLENCE YEAH YEAH YEAHWANNA SEE ME STICK NINE INCH NAILS THROUGH EACH ONE OF MY EYELIDS UHHUHWANNA COPY ME AND DO EXACTLY LIKE I DID YEAH YEAHTRY CID AND GET FUCKED UP WORSE THEN MY LIFE IS HUHMY BRAINS DEAD WEIGHT IM TRYIN TO GET MY HEAD STRAIGHTBUT I CANT FIGURE OUT WHICH SPICE GIRL I WANT TO IMPREGNATE UMMMMAND DR DRE SAID SLIM SHADY YOU A BASEHEADUHUHHH THEN WHYS YOUR FACE RED MAN YOU WASTEDWELL SINCE AGE TWELVE IVE FELT LIKE IM SOMEONE ELSECAUSE I HUNG MY ORIGINAL SELF FROM THE TOP BUNK WITH A BELTGOT PISSED OFF AND RIPPED PAMELA LEES TITS OFFAND SMACKED HER SO HARD I KNOCKED HER CLOTHES BACKWARDS LIKE KRIS KROSSI SMOKE A FAT POUND OF GRASS AND FALL ON MY ASSFASTER THAN A FAT BITCH WHO SAT DOWN TOO FASTCMERE SLUT SHADY WAIT A MINUTE THATS MY GIRL DOGI DONT GIVE A FUCK GOD SENT ME TO PISS THE WORLD OFFCHORUSHI MY NAME IS WHATMY NAME IS WHOMY NAME IS CHIKI CHIKI SLIM SHADYHI MY NAME IS HUHMY NAME IS WHATMY NAME IS CHIKI CHIKI SLIM SHADYHI MY NAME IS WHATMY NAME IS WHOMY NAME IS CHIKI CHIKI SLIM SHADYHI MY NAME IS HUHMY NAME IS WHATMY NAME IS CHIKI CHIKI SLIM SHADYEMINEMMY ENGLISH TEACHER WANTED TO HAVE SEX IN JUNIOR HIGHTHE ONLY PROBLEM WAS MY ENGLISH TEACHER WAS A GUYI SMACKED HIM IN HIS FACE WITH AN ERASER CHASED HIM WITH A STAPLERAND STAPLED HIS NUTS TO A STACK OF PAPER OWWWWWWWWWALKED IN THE STRIP CLUB HAD MY JACKET ZIPPED UPFLASHED THE BARTENDER THEN STUCK MY DICK IN THE TIP CUPEXTRATERRESTRIAL KILLIN PEDESTRIANS RAPIN LESBIANSWHILE THEYRE SCREAMIN LETS JUST BE FRIENDSNINETYNINE PERCENT OF MY LIFE I WAS LIED TOI JUST FOUND OUT MY MOM DOES MORE DOPE THAN I DO DAMNI TOLD HER ID GROW UP TO BE A FAMOUS RAPPERMAKE A RECORD ABOUT DOIN DRUGS AND NAME IT AFTER HER OH THANK YOUYOU KNOW YOU BLEW UP WHEN THE WOMEN RUSH THE STANDSAND TRY TO TOUCH YOUR HANDS LIKE SOME SCREAMIN USHER FANS AAAHHHHHHTHIS GUY AT WHITE CASTLE ASKED FOR MY AUTOGRAPHDUDE CAN I GET YOUR AUTOGRAPHSO I SIGNED IT DEAR DAVE THANKS FOR THE SUPPORT ASSHOLECHORUSHI MY NAME IS WHATMY NAME IS WHOMY NAME IS CHIKI CHIKI SLIM SHADYHI MY NAME IS HUHMY NAME IS WHATMY NAME IS CHIKI CHIKI SLIM SHADYHI MY NAME IS WHATMY NAME IS WHOMY NAME IS CHIKI CHIKI SLIM SHADYHI MY NAME IS HUHMY NAME IS WHATMY NAME IS CHIKI CHIKI SLIM SHADYEMINEMSTOP THE TAPE THIS KID NEEDS TO BE LOCKED AWAY GET HIMDR DRE DONT JUST STAND THERE OPERATEIM NOT READY TO LEAVE ITS TOO SCARY TO DIE FUCK THATILL HAVE TO BE CARRIED INSIDE THE CEMETERY AND BURIED ALIVEHUH YUPAM I COMIN OR GOIN I CAN BARELY DECIDEI JUST DRANK A FIFTH OF VODKA DARE ME TO DRIVE GO AHEADALL MY LIFE I WAS VERY DEPRIVEDI AINT HAD A WOMAN IN YEARS AND MY PALMS ARE TOO HAIRY TO HIDE WHOOPSCLOTHES RIPPED LIKE THE INCREDIBLE HULK HACHHHTOOI SPIT WHEN I TALK ILL FUCK ANYTHING THAT WALKS CMEREWHEN I WAS LITTLE I USED TO GET SO HUNGRY I WOULD THROW FITSHOW YOU GONNA BREAST FEED ME MOM WAHYOU AINT GOT NO TITS WAHHHI LAY AWAKE AND STRAP MYSELF IN THE BEDPUT A BULLEPROOF VEST ON AND SHOOT MYSELF IN THE HEAD BANGIM STEAMIN MAD ARRRGGGHHHAND BY THE WAY WHEN YOU SEE MY DAD YEAHTELL HIM THAT I SLIT HIS THROAT IN THIS DREAM I HADCHORUSHI MY NAME IS WHATMY NAME IS WHOMY NAME IS CHIKI CHIKI SLIM SHADYHI MY NAME IS HUHMY NAME IS WHATMY NAME IS CHIKI CHIKI SLIM SHADYHI MY NAME IS WHATMY NAME IS WHOMY NAME IS CHIKI CHIKI SLIM SHADYHI MY NAME IS HUHMY NAME IS WHATMY NAME IS CHIKI CHIKI SLIM SHADY
Eminem,INTROWHERES MY SNAREI HAVE NO SNARE ON MY HEADPHONESTHERE YOU GOYEAHYO YOHAVE YOU EVER BEEN HATED OR DISCRIMINATED AGAINSTI HAVE IVE BEEN PROTESTED AND DEMONSTRATED AGAINSTPICKET SIGNS FOR MY WICKED RHYMES LOOK AT THE TIMESSICK AS THE MIND OF THE MOTHERFUCKING KID THATS BEHINDALL THIS COMMOTION EMOTIONS RUN DEEP AS OCEANS EXPLODINTEMPERS FLARIN FROM PARENTS JUST BLOW EM OFF AND KEEP GOINNOT TAKIN NOTHIN FROM NO ONE GIVE EM HELL LONG AS IM BREATHINKEEP KICKIN ASS IN THE MORNIN AND TAKIN NAMES IN THE EVENINLEAVING WITH A TASTE AS SOUR AS VINEGAR IN THEIR MOUTHSEE THEY CAN TRIGGA ME BUT THEYLL NEVA FIGURE ME OUTLOOK AT ME NOW I BETCHA PROBLEY SICK OF ME NOWAINT YOU MAMA I MA MAKE YOU LOOK SO RIDICULOUS NOWCHORUSIM SORRY MAMAI NEVER MEANT TO HURT YOUI NEVER MEANT TO MAKE YOU CRYBUT TONIGHT IM CLEANIN OUT MY CLOSETONE MORE TIMEI SAIDIM SORRY MAMAI NEVER MEANT TO HURT YOUI NEVER MEANT TO MAKE YOU CRYBUT TONIGHT IM CLEANIN OUT MY CLOSETHAI GOT SOME SKELETONS IN MY CLOSETAND I DONT KNOW IF NO ONE KNOWS ITSO BEFORE THEY THROW ME INSIDE MY COFFIN AND CLOSE ITIMA EXPOSE IT ILL TAKE YOU BACK TO BEFORE I EVER HAD A MULTIPLATINUM SELLIN CDI WAS A BABY MAYBE I WAS JUST A COUPLA MONTHSMY FAGGOT FATHER MUSTVE HAD HIS PANTIES UP IN A BUNCHCAUSE HE SPLIT I WONDER IF HE EVEN KISSED MY GOODBYENO I DONT ON SECOND THOUGHT I JUST FUCKIN WISHED HE WOULD DIEI LOOK AT HAILIE AND I COULDNT PICTURE LEAVING HER SIDEEVEN IF I HATED KIM ID GRIT MY TEETH AND ID TRY TO MAKE IT WORKWIT HER AT LEAST FOR HAILIES SAKEI MAYBE MADE SOME MISTAKESBUT IM ONLY HUMAN BUT IM MAN ENOUGH TO FACE EM TODAYWHAT I DID WAS STUPID NO DOUBT IT WAS DUMBBUT THE SMARTEST SHIT I DID WAS TAKE THE BULLETS OUTTA THAT GUNCAUSE ID OF KILLED EM SHIT I WOULDA SHOT KIM AND THEM BOTHITS MY LIFE ID LIKE TO WELCOME YALL TO THE EMINEM SHOWCHORUSNOW I WOULD NEVER DISS MY OWN MAMA JUST TO GET RECOGNITIONTAKE A SECOND TO LISTEN FORE YOU THINK THIS RECORD IS DISSINBUT PUT YOURSELF IN MY POSITION JUST TRY TO ENVISIONWITNESSIN YOUR MAMA POPPIN PRESCRIPTION PILLS IN THE KITCHENBITCHIN THAT SOMEONES ALWAYS GOIN THROUGH HEAR PURSE AND SHITS MISSINGOIN THROUGH PUBLIC HOUSIN SYSTEMS VICTIM OF MUNCHAUSENS SYNDROMEMY WHOLE LIFE I WAS MADE TO BELIEVE I WAS SICK WHEN I WASNT TIL I GREW UP NOW I BLEW UP IT MAKES YOU SICK TO YA STOMACH DOESNT ITWASNT IT THE REASON YOU MADE THAT CD FOR ME MASO YOU COULD TRY TO JUSTIFY THE WAY YOU TREATED ME MABUT GUESS WHAT YA GETTIN OLDA NOW AND ITS COLD WHEN YAW LONELYAND NATHANS GROWIN UP SO QUICK HES GOING TO KNOW THAT YAW PHONYAND HAILIES GETTING SO BIG NOW YOU SHOULD SEE HER SHES BEAUTIFULBUT YOULL NEVER SEE HER SHE WONT EVEN BE AT YOUR FUNERALSEE WHETS HURTS ME THE MOST IS YOU WONT ADMIT YOU WAS WRONGBITCH DO YOUR SONG KEEP TELLIN YASELF THAT YOU WAS A MOMBUT HOW DARE YOU TRY TO TAKE WHEN YOU DIDNT HELP ME TO GETYOU SELFISH BITCHI HOPE YOU FUCKIN BURN IN HELL FOR THIS SHITREMEMBER WHEN RONNIE DIED AND YOU SAID YOU WISHED IT WAS MEWELL GUESS WHAT I AM DEAD DEAD TO YOU AS CAN BECHORUS
Eminem,NOT AFRAIDCHORUSIM NOT AFRAID IM NOT AFRAIDTO TAKE A STAND TO TAKE A STANDEVERYBODY EVERYBODYCOME TAKE MY HAND COME TAKE MY HANDWELL WALK THIS ROAD TOGETHER THROUGH THE STORMWHATEVER WEATHER COLD OR WARMJUST LETTING YOU KNOW THAT YOURE NOT ALONEHOLLER IF YOU FEEL LIKE YOUVE BEEN DOWN THE SAME ROAD SAME ROADINTRO DURING CHORUSYEAH ITS BEEN A RIDEI GUESS I HAD TO GO TO THAT PLACE TO GET TO THIS ONENOW SOME OF YOU MIGHT STILL BE IN THAT PLACEIF YOURE TRYING TO GET OUT JUST FOLLOW MEILL GET YOU THEREYOU CAN TRY AND READ MY LYRICS OFF OF THIS PAPER BEFORE I LAY EMBUT YOU WONT TAKE THE STING OUT THESE WORDS BEFORE I SAY EMCAUSE AINT NO WAY IMA LET YOU STOP ME FROM CAUSING MAYHEMWHEN I SAY IMA DO SOMETHING I DO ITI DONT GIVE A DAMN WHAT YOU THINKIM DOING THIS FOR ME SO FUCK THE WORLDFEED IT BEANS ITS GASSED UP IF IT THINKS ITS STOPPING MEIMA BE WHAT I SET OUT TO BE WITHOUT A DOUBT UNDOUBTEDLYAND ALL THOSE WHO LOOK DOWN ON ME IM TEARING DOWN YOUR BALCONYNO IFS ANDS OR BUTS DONT TRY TO ASK HIM WHY OR HOW CAN HEFROM INFINITE DOWN TO THE LAST RELAPSE ALBUMHES STILL SHITTING WHETHER HES ON SALARY PAID HOURLYUNTIL HE BOWS OUT OR HE SHITS HIS BOWELS OUT OF HIMWHICHEVER COMES FIRST FOR BETTER OR WORSEHES MARRIED TO THE GAME LIKE A FUCK YOU FOR CHRISTMASHIS GIFT IS A CURSE FORGET THE EARTH HES GOT THE URGETO PULL HIS DICK FROM THE DIRT AND FUCK THE WHOLE UNIVERSECHORUSOKAY QUIT PLAYING WITH THE SCISSORS AND SHIT AND CUT THE CRAPI SHOULDNT HAVE TO RHYME THESE WORDS IN THE RHYTHM FOR YOU TO KNOW ITS A RAPYOU SAID YOU WAS KING YOU LIED THROUGH YOUR TEETH FOR THATFUCK YOUR FILLINGS INSTEAD OF GETTING CROWNED YOURE GETTING CAPPEDAND TO THE FANS ILL NEVER LET YOU DOWN AGAIN IM BACKI PROMISE TO NEVER GO BACK ON THAT PROMISE IN FACTLETS BE HONEST THAT LAST RELAPSE CD WAS EHHHPERHAPS I RAN THEM ACCENTS INTO THE GROUNDRELAX I AINT GOING BACK TO THAT NOWALL IM TRYING TO SAY IS GET BACK CLICKCLACK BLOWCAUSE I AINT PLAYING AROUNDITS A GAME CALLED CIRCLE AND I DONT KNOW HOW IM WAY TOO UP TO BACK DOWNBUT I THINK IM STILL TRYING TO FIGURE THIS CRAP OUTTHOUGHT I HAD IT MAPPED OUT BUT I GUESS I DIDNT THIS FUCKING BLACK CLOUDSTILL FOLLOWS ME AROUND BUT ITS TIME TO EXORCISE THESE DEMONSTHESE MOTHERFUCKERS ARE DOING JUMPING JACKS NOWCHORUSAND I JUST CANT KEEP LIVING THIS WAYSO STARTING TODAY IM BREAKING OUT OF THIS CAGEIM STANDING UP IMA FACE MY DEMONSIM MANNING UP IMA HOLD MY GROUNDIVE HAD ENOUGH NOW IM SO FED UPTIME TO PUT MY LIFE BACK TOGETHER RIGHT NOW NOWIT WAS MY DECISION TO GET CLEAN I DID IT FOR MEADMITTEDLY I PROBABLY DID IT SUBLIMINALLYFOR YOU SO I COULD COME BACK A BRAND NEW ME YOU HELPED SEE ME THROUGHAND DONT EVEN REALIZE WHAT YOU DID CAUSE BELIEVE ME YOUI BEEN THROUGH THE RINGER BUT THEY COULD DO LITTLE TO THE MIDDLE FINGERI THINK I GOT A TEAR IN MY EYE I FEEL LIKE THE KING OFMY WORLD HATERS CAN MAKE LIKE BEES WITH NO STINGERSAND DROP DEAD NO MORE BEEF LINGERSNO MORE DRAMA FROM NOW ON I PROMISETO FOCUS SOLELY ON HANDLING MY RESPONSIBILITIES AS A FATHERSO I SOLEMNLY SWEAR TO ALWAYS TREAT THIS ROOF LIKE MY DAUGHTERSAND RAISE IT YOU COULDNT LIFT A SINGLE SHINGLE ON ITCAUSE THE WAY I FEEL IM STRONG ENOUGH TO GO TO THE CLUBOR THE CORNER PUB AND LIFT THE WHOLE LIQUOR COUNTER UPCAUSE IM RAISING THE BARID SHOOT FOR THE MOON BUT IM TOO BUSY GAZING AT STARSI FEEL AMAZING AND IMCHORUS
Eminem,MAN WHATEVERDRE JUST LET IT RUNAYO TURN THE BEAT UP A LITTLE BITAYOTHIS SONG IS FOR ANYONEFUCK IT JUST SHUT UP AND LISTENAYOI SIT BACK WITH THIS PACK OF ZIGZAGS AND THIS BAGOF THIS WEED IT GIVES ME THE SHIT NEEDED TO BETHE MOST MEANEST MC ON THIS ON THIS EARTHAND SINCE BIRTH IVE BEEN CURSED WITH THIS CURSE TO JUST CURSEAND JUST BLURT THIS BERSERK AND BIZARRE SHIT THAT WORKSAND IT SELLS AND IT HELPS IN ITSELF TO RELIEVEALL THIS TENSION DISPENSIN THESE SENTENCESGETTIN THIS STRESS THATS BEEN EATIN ME RECENTLY OFFOF THIS CHEST AND I REST AGAIN PEACEFULLY PEACEFULLYBUT AT LEAST HAVE THE DECENCY IN YOUTO LEAVE ME ALONE WHEN YOU FREAKS SEE ME OUTIN THE STREETS WHEN IM EATIN OR FEEDIN MY DAUGHTERTO NOT COME AND SPEAK TO ME SPEAK TO ME I DONT KNOW YOUAND NO I DONT OWE YOU A MOTHERFUCKIN THINGIM NOT MR NSYNC IM NOT WHAT YOUR FRIENDS THINKIM NOT MR FRIENDLY I CAN BE A PRICKIF YOU TEMPT ME MY TANK IS ON EMPTY IS ON EMPTYNO PATIENCE IS IN ME AND IF YOU OFFEND MEIM LIFTIN YOU TEN FEET LIFTIN YOU TEN FEET IN THE AIRI DONT CARE WHO WAS THERE AND WHO SAW ME JUST JAW YOUGO CALL YOU A LAWYER FILE YOU A LAWSUITILL SMILE IN THE COURTROOM AND BUY YOU A WARDROBEIM TIRED OF ALL YOU OF ALL YOU I DONT MEAN TO BE MEANBUT THATS ALL I CAN BE ITS JUST MEAND I AM WHATEVER YOU SAY I AMIF I WASNT THEN WHY WOULD I SAY I AMIN THE PAPER THE NEWS EVERY DAY I AMRADIO WONT EVEN PLAY MY JAMCAUSE I AM WHATEVER YOU SAY I AMIF I WASNT THEN WHY WOULD I SAY I AMIN THE PAPER THE NEWS EVERY DAY I AMI DONT KNOW THATS JUST THE WAY I AMSOMETIMES I JUST FEEL LIKE MY FATHER I HATE TO BE BOTHEREDWITH ALL OF THIS NONSENSE ITS CONSTANTAND OH ITS HIS LYRICAL CONTENTTHE SONG GUILTY CONSCIENCE HAS GOTTEN SUCH ROTTEN RESPONSESAND ALL OF THIS CONTROVERSY CIRCLES MEAND IT SEEMS LIKE THE MEDIA IMMEDIATELYPOINTS A FINGER AT ME FINGER AT MESO I POINT ONE BACK AT EM BUT NOT THE INDEX OR PINKIEOR THE RING OR THE THUMB ITS THE ONE YOU PUT UPWHEN YOU DONT GIVE A FUCK WHEN YOU WONT JUST PUT UPWITH THE BULLSHIT THEY PULL CAUSE THEY FULL OF SHIT TOOWHEN A DUDES GETTIN BULLIED AND SHOOTS UP HIS SCHOOLAND THEY BLAME IT ON MARILYN ON MARILYN AND THE HEROINWHERE WERE THE PARENTS AT AND LOOK WHERE ITS ATMIDDLE AMERICA NOW ITS A TRAGEDYNOW ITS SO SAD TO SEE AN UPPERCLASS CITYHAVIN THIS HAPPENIN THIS HAPPENIN THEN ATTACKEMINEM CAUSE I RAP THIS WAY RAP THIS WAY BUT IM GLADCAUSE THEY FEED ME THE FUEL THAT I NEED FOR THE FIRE TO BURNAND ITS BURNIN AND I HAVE RETURNEDAND I AM WHATEVER YOU SAY I AMIF I WASNT THEN WHY WOULD I SAY I AMIN THE PAPER THE NEWS EVERY DAY I AMRADIO WONT EVEN PLAY MY JAMCAUSE I AM WHATEVER YOU SAY I AMIF I WASNT THEN WHY WOULD I SAY I AMIN THE PAPER THE NEWS EVERY DAY I AMI DONT KNOW THATS JUST THE WAY I AMIM SO SICK AND TIRED OF BEIN ADMIREDTHAT I WISH THAT I WOULD JUST DIE OR GET FIREDAND DROPPED FROM MY LABEL LETS STOP WITH THE FABLESIM NOT GONNA BE ABLE TO TOP A MY NAME ISAND PIGEONHOLED INTO SOME POPPY SENSATIONTO COP ME ROTATION AT ROCK N ROLL STATIONSAND I JUST DO NOT GOT THE PATIENCE GOT THE PATIENCETO DEAL WITH THESE COCKY CAUCASIANSWHO THINK IM SOME WIGGER WHO JUST TRIES TO BE BLACK CAUSE I TALKWITH AN ACCENT AND GRAB ON MY BALLS SO THEY ALWAYSKEEP ASKIN THE SAME FUCKIN QUESTIONS FUCKIN QUESTIONSWHAT SCHOOL DID I GO TO WHAT HOOD I GREW UP INTHE WHY THE WHO WHAT WHEN THE WHERE AND THE HOWTIL IM GRABBIN MY HAIR AND IM TEARIN IT OUTCAUSE THEY DRIVIN ME CRAZY DRIVIN ME CRAZY I CANT TAKE ITIM RACIN IM PACIN I STAND AND I SITAND IM THANKFUL FOR EVERY FAN THAT I GETBUT I CANT TAKE A SHIT IN THE BATHROOM WITHOUTSOMEONE STANDIN BY IT STANDIN BY IT NO I WONT SIGN YOUR AUTOGRAPHYOU CAN CALL ME AN ASSHOLE IM GLADCAUSE I AM WHATEVER YOU SAY I AMIF I WASNT THEN WHY WOULD I SAY I AMIN THE PAPER THE NEWS EVERY DAY I AMRADIO WONT EVEN PLAY MY JAMCAUSE I AM WHATEVER YOU SAY I AMIF I WASNT THEN WHY WOULD I SAY I AMIN THE PAPER THE NEWS EVERY DAY I AMI DONT KNOW THATS JUST THE WAY I AM
Eminem,OBIE TRICEOBIE TRICE REAL NAME NO GIMMICKSEMINEMTWO TRAILER PARK GIRLS GO ROUND THE OUTSIDEROUND THE OUTSIDE ROUND THE OUTSIDETWO TRAILER PARK GIRLS GO ROUND THE OUTSIDEROUND THE OUTSIDE ROUND THE OUTSIDEFEMALE VOICEOOOOOHHHHHEMINEMGUESS WHOS BACK BACK BACKBACK AGAINGAIN GAINSHADYS BACK BACK BACKTELL A FRIENDGUESS WHOS BACK GUESS WHOS BACKGUESS WHOS BACK GUESS WHOS BACKGUESS WHOS BACK GUESS WHOS BACKGUESS WHOS BACK LA LA LAIVE CREATED A MONSTER CUZ NOBODY WANTS TOSEE MARSHALL NO MORE THEY WANT SHADYIM CHOPPED LIVERWELL IF YOU WANT SHADY THIS IS WHAT ILL GIVE YAA LITTLE BIT OF WEED MIXED WITH SOME HARD LIQUORSOME VODKA THAT WILL JUMPSTART MY HEART QUICKERTHEN A SHOCK WHEN I GET SHOCKED AT THE HOSPITALBY THE DR WHEN IM NOT COOPERATINGWHEN IM ROCKING THE TABLE WHILE HES OPERATING HEYYOU WAITED THIS LONG TO STOP DEBATINGCUZ IM BACK IM ON THE RAG AND OVULATINGI KNOW THAT YOU GOT A JOB MS CHENEYBUT YOUR HUSBANDS HEART PROBLEM IS COMPLICATEDSO THE FCC WONT LET ME BEOR LET ME BE ME SO LET ME SEETHEY TRIED TO SHUT ME DOWN ON MTVBUT IT FEELS SO EMPTY WITHOUT MESO COME ON DIP BUM ON YOUR LIPSFUCK THAT CUM ON YOUR LIPS AND SOME ON YOUR TITSAND GET READY CUZ THIS SHITS ABOUT TO GET HEAVYI JUST SETTLED ALL MY LAWSUITS FUCK YOU DEBBIENOW THIS LOOKS A JOB FOR MESO EVERYBODY JUST FOLLOW MECUZ WE NEED A LITTLE CONTROVERSYCUZ IT FEELS SO EMPTY WITHOUT MEI SAID THIS LOOKS LIKE A JOB FOR MESO EVERYBODY JUST FOLLOW MECUZ WE NEED A LITTLE CONTROVERSYCUZ IT FEELS SO EMPTY WITHOUT MELITTLE HELLIONS KIDS FEELING REBELLIOUSEMBARRASSED THEIR PARENTS STILL LISTEN TO ELVISTHEY START FEELING LIKE PRISON IS HELPLESSTIL SOMEONE COMES ALONG ON A MISSION AND YELLS BITCHA VISIONARY VISION IS SCARY COULD START A REVOLUTIONPOLLUTIN THE AIR WAVES A REBELSO LET ME JUST REVEL AND BASKIN THE FACT THAT I GOT EVERYONE KISSING MY ASSAND ITS A DISASTER SUCH A CATASTROPHEFOR YOU TO SEE SO DAMN MUCH OF MY ASS YOU ASK FOR MEWELL IM BACK FIX YOUR BENT ANTENNATUNE IT IN AND THEN IM GONNA ENTERINTO THE FRONT OF YOUR SKIN LIKE A SPLINTERTHE CENTER OF ATTENTION BACK FOR THE WINTERIM INTERESTING THE BEST THING SINCE WRESTLINGINFESTING IN YOUR KIDS EARS AND NESTINGTESTING ATTENTION PLEASEFEEL THE TENSION SOON AS SOMEONE MENTIONS MEHERES MY CENTS MY CENTS IS FREEA NUISANCE WHO SENT YOU SENT FOR MENOW THIS LOOKS LIKE A JOB FOR MESO EVERYBODY JUST FOLLOW MECUZ WE NEED A LITTLE CONTROVERSYCUZ IT FEELS SO EMPTY WITHOUT MEI SAID THIS LOOKS LIKE A JOB FOR MESO EVERYBODY JUST FOLLOW MECUZ WE NEED A LITTLE CONTROVERSYCUZ IT FEELS SO EMPTY WITHOUT MEA TISKIT A TASKITI GO TIT FOR TAT WITH ANYBODY WHOS TALKING THIS SHIT THAT SHITCHRIS KIRKPATRICK YOU CAN GET YOUR ASS KICKEDWORSE THAN THEM LITTLE LIMP BIZKIT BASTARDSAND MOBY YOU CAN GET STOMPED BY OBIEYOU YEAR OLD BALD HEADED FAG BLOW MEYOU DONT KNOW ME YOURE TOO OLDLET GO ITS OVER NOBODY LISTENS TO TECHNONOW LETS GO JUST GIVE ME THE SIGNALI WILL BE THERE WITH A WHOLE LIST FULL OF NEW INSULTSIVE BEEN DOPE SUSPENSEFUL WITH A PENCILEVER SINCE PRINCE TURNED HIMSELF INTO A SYMBOLBUT SOMETIMES THE SHIT JUST SEEMSEVERYBODY ONLY WANTS TO DISCUSS MESO THIS MUST MEAN IM DISGUSTINGBUT ITS JUST ME IM JUST OBSCENETHOUGH IM NOT THE FIRST KING OF CONTROVERSYI AM THE WORST THING SINCE ELVIS PRESLEYTO DO BLACK MUSIC SO SELFISHLYAND USE IT TO GET MYSELF WEALTHY HEYTHERES A CONCEPT THAT WORKS MILLION OTHER WHITE RAPPERS EMERGEBUT NO MATTER HOW MANY FISH IN THE SEAITLL BE SO EMPTY WITHOUT MENOW THIS LOOKS LIKE A JOB FOR MESO EVERYBODY JUST FOLLOW MECUZ WE NEED A LITTLE CONTROVERSYCUZ IT FEELS SO EMPTY WITHOUT MEI SAID THIS LOOKS LIKE A JOB FOR MESO EVERYBODY JUST FOLLOW MECUZ WE NEED A LITTLE CONTROVERSYCUZ IT FEELS SO EMPTY WITHOUT MENA NA NA NA NA NA NA NA NA NANA NA NA NA NA NATIMES KIDS
