Artist,Track
TOOL,I KNOW THE PIECES FITCAUSE I WATCHED EM FALL AWAYMILDEWED AND SMOLDERINGFUNDAMENTAL DIFFERINGPURE INTENTION JUXTAPOSEDWILL SET TWO LOVERS SOULS IN MOTIONDISINTEGRATING AS IT GOESTESTING OUR COMMUNICATIONTHE LIGHT THAT FUELED OUR FIRE THENHAS A BURNED A HOLE BETWEEN US SOWE CANNOT SEE TO REACH AN ENDCRIPPLING OUR COMMUNICATIONI KNOW THE PIECES FITCAUSE I WATCHED THEM TUMBLE DOWNNO FAULT NONE TO BLAMETHAT DOESNT MEAN I DONT DESIRE TOPOINT THE FINGER BLAME THE OTHERWATCH THE TEMPLE TOPPLE OVERTO BRING THE PIECES BACK TOGETHER ANDREDISCOVER COMMUNICATIONTHE POETRYTHAT COMES FROM THE SQUARINGOFF BETWEENAND THE CIRCLING IS WORTH ITFINDING BEAUTY IN THE DISSONANCETHERE WAS A TIME THAT THE PIECES FITBUT I WATCHED THEM FALL AWAYMILDEWED AND SMOLDERINGSTRANGLED BY OUR COVETINGIVE DONE THE MATH ENOUGH TO KNOWTHE DANGERS OF OUR SECOND GUESSINGWERE DOOMED TO CRUMBLE UNLESS WE GROWWE MUST STRENGTHEN OUR COMMUNICATIONCOLD COLD COLDCOLD SILENCE HASA TENDENCY TOATROPHY ANYSENSE OF COMPASSIONBETWEEN SUPPOSED LOVERSBETWEEN SUPPOSED LOVERSI KNOW THE PIECES FITI KNOW THE PIECES FITI KNOW THE PIECES FITI KNOW THE PIECES FITI KNOW THE PIECES FITI KNOW THE PIECES FITI KNOW THE PIECES FITI KNOW THE PIECES FIT
TOOL,THERES A SHADOW JUST BEHIND MESHROUDING EVERY STEP I TAKEMAKING EVERY PROMISE EMPTYPOINTING EVERY FINGER AT MEWAITING LIKE A STALKING BUTLERWHO UPON THE FINGER RESTSMURDER NOW THE PATH CALLED QUOTMUST WEQUOTJUST BECAUSE THE SON HAS COMEJESUS WONT YOU FUCKING WHISTLESOMETHING BUT THE PAST AND DONEJESUS WONT YOU FUCKING WHISTLESOMETHING BUT THE PAST AND DONEWHY CANT WE NOT BE SOBERI JUST WANT TO START THIS OVERAND WHY CANT WE DRINK FOREVERI JUST WANT TO START THIS OVERI AM JUST A WORTHLESS LIARI AM JUST AN IMBECILEI WILL ONLY COMPLICATE YOUTRUST IN ME AND FALL AS WELLI WILL FIND A CENTER IN YOUI WILL CHEW IT UP AND LEAVEI WILL WORK TO ELEVATE YOUJUST ENOUGH TO BRING YOU DOWNMOTHER MARY WONT YOU WHISPERSOMETHING BUT WHATS PAST AND DONEMOTHER MARY WONT YOU WHISPERSOMETHING BUT THE PAST AND DONEWHY CANT WE NOT BE SOBERI JUST WANT TO START THIS OVERAND WHY CANT WE SLEEP FOREVERI JUST WANT TO START THIS OVERWHYI AM JUST A WORTHLESS LIARI AM JUST AN IMBECILEI WILL ONLY COMPLICATE YOUTRUST IN ME AND FALL AS WELLI WILL FIND A CENTER IN YOUI WILL CHEW IT UP AND LEAVETRUST METRUST METRUST METRUST METRUST MEWHY CANT WE NOT BE SOBERI JUST WANT TO START THINGS OVERAND WHY CANT WE SLEEP FOREVERI JUST WANT TO START THIS OVERWHYI WANT WHAT I WANTI WANT WHAT I WANTI WANT WHAT I WANTI WANT WHAT I WANT
TOOL,EYE ON THE TVCAUSE TRAGEDY THRILLS MEWHATEVER FLAVOR IT HAPPENS TO BELIKEKILLED BY THE HUSBANDDROWNED BY THE OCEANSHOT BY HIS OWN SONSHE USED A POISON IN HIS TEATHEN SHE KISSED HIM GOODBYETHATS MY KIND OF STORYITS NO FUN TILL SOMEONE DIESDONT LOOK AT ME LIKEI AM A MONSTERFROWN OUT YOUR ONE FACEBUT WITH THE OTHER YOUSTARE LIKE A JUNKIEINTO THE TVSTARE LIKE A ZOMBIEWHILE THE MOTHER HOLDS HER CHILDWATCHES HIM DIEHANDS TO THE SKY CRYINWHY OH WHYCAUSE I NEED TO WATCH THINGS DIEFROM A DISTANCEVICARIOUSLY I LIVE WHILE THE WHOLE WORLD DIESYOU ALL NEED IT TOO DONT LIEWHY CANT WE JUST ADMIT ITWE WONT GIVE PAUSE UNTILLTHE BLOOD IS FLOWINGNEITHER THE BRAVE NOR BOLDNOR BRIGHTEST OF STORIES TOLDWE WONT GIVE PAUSE UNTILLTHE BLOOD IS FLOWINGI NEED TO WATCH THINGS DIEFROM A GOOD SAFE DISTANCEVICARIOUSLY I LIVE WHILE THE WHOLE WORLD DIESYOU ALL FEEL THE SAME SO WHY CANT WE JUST ADMIT ITBLOOD LIKE RAIN COME DOWNDRUM ON GRAVE AND GROUNDPART VAMPIREPART WARRIORCARNIVOREAND VOYEURSTARE AT THE TRANSMITTALSING TO THE DEATH RATTLECREDULOUS AT BESTYOUR DESIRE TO BELIEVE INANGELS IN THE HEARTS OF MENPULL YOUR HEAD ON OUTYOUR HIPPY HAZE AND GIVE A LISTENSHOULDNT HAVE TO SAY IT ALL AGAINTHE UNIVERSE IS HOSTILESO IMPERSONALDEVOUR TO SURVIVESO IT ISSO ITS ALWAYS BEENWE ALL FEED ON TRAGEDYITS LIKE BLOOD TO A VAMPIREVICARIOUSLY I LIVE WHILE THE WHOLE WORLD DIESMUCH BETTER YOU THAN I
TOOL,SOMETHING HAS TO CHANGEUNDENIABLE DILEMMABOREDOMS NOT A BURDENANYONE SHOULD BEARCONSTANT OVERSTIMULATION NUMBS MEBUT I WOULD NOT WANT YOU ANY OTHER WAYJUSTITS NOT ENOUGHI NEED MORENOTHING SEEMS TO SATISFYI SAIDI DONT WANT ITI JUST NEED ITTO BREATHETO FEELTO KNOW IM ALIVEFINGER DEEP WITHIN THE BORDERLINESHOW ME THAT YOU LOVE ME AND THAT WE BELONG TOGETHERRELAX TURN AROUND AND TAKE MY HANDI CAN HELP YOU CHANGETIRED MOMENTS INTO PLEASURESAY THE WORD AND WELL BE WELL UPON OUR WAYBLEND AND BALANCEPAIN AND COMFORTDEEP WITHIN YOUTIL YOU WILL NOT WANT ME ANY OTHER WAYBUT ITS NOT ENOUGHI NEED MORENOTHING SEEMS TO SATISFYI SAIDI DONT WANT ITI JUST NEED ITTO BREATHETO FEELTO KNOW IM ALIVEKNUCKLE DEEP INSIDE THE BORDERLINETHIS MAY HURT A LITTLE BUT ITS SOMETHING YOULL GET USED TORELAX SLIP AWAYTHERES SOMETHING KINDA SAD ABOUTTHE WAY THAT THINGS HAVE COME TO BEDESENSITIZED TO EVERYTHINGWHAT BECAME OF SUBTLETYHOW CAN THIS MEAN ANYTHING TO MEIF I REALLY DONT FEEL ANYTHING AT ALLYEAHILL KEEP DIGGINGUNTIL I FEEL SOMETHINGELBOW DEEP INSIDE THE BORDERLINESHOW ME THAT YOU LOVE ME AND THAT WE BELONG TOGETHERSHOULDER DEEP WITHIN THE BORDERLINERELAX TURN AROUND AND TAKE MY HAND
TOOL,WE BARELY REMEMBERWHO OR WHAT CAME BEFORE THIS PRECIOUS MOMENTWE ARE CHOOSING TO BE HERERIGHT NOWHOLD ON STAY INSIDETHIS HOLY REALITYTHIS HOLY EXPERIENCECHOOSING TO BE HERE INTHIS BODYTHIS BODY HOLDING MEBE MY REMINDER HERE THAT I AM NOT ALONE INTHIS BODYTHIS BODY HOLDING MEFEELING ETERNAL ALL THIS PAIN IS AN ILLUSIONALIVEIMIN THIS HOLY REALITYIN THIS HOLY EXPERIENCECHOOSING TO BE HERE INTHIS BODYTHIS BODY HOLDING MEBE MY REMINDER HERE THAT I AM NOT ALONE INTHIS BODYTHIS BODY HOLDING MEFEELING ETERNAL ALL THIS PAIN IS AN ILLUSIONTWIRLING ROUND WITH THIS FAMILIAR PARABLESPINNING WEAVING ROUND EACH NEW EXPERIENCERECOGNIZE THIS AS A HOLY GIFT ANDCELEBRATE THIS CHANCE TO BEALIVE AND BREATHINGA CHANCE TO BEALIVE AND BREATHINGTHIS BODY HOLDING MEREMINDS ME OF MY OWN MORTALITYEMBRACE THIS MOMENT REMEMBERWE ARE ETERNAL ALL THIS PAIN IS AN ILLUSION
TOOL,HERE FROM A KINGS MOUNTAIN VIEWHERE FROM A WILD DREAM COME TRUEFEAST LIKE A SULTAN I DOON TREASURES AND FLESH NEVER FEWBUT I WOULD WISH IT ALL AWAY IF I THOUGHT ID LOSE YOU JUST ONE DAYTHE DEVIL AND HIS HAD ME DOWNIN LOVE WITH THE DARK SIDE ID FOUNDDABBLING ALL THE WAY DOWNUP TO MY NECK SOON TO DROWNBUT YOU CHANGED THAT ALL FOR MELIFTED ME UP TURNED ME ROUNDSO IIIII WOULDI WOULDI WOULD WISH THIS ALL AWAYPRAYED LIKE A MARTYR DUSK TO DAWNBEGGED LIKE A HOOKER ALL NIGHT LONGTEMPTED THE DEVIL WITH MY SONGAND GOT WHAT I WANTED ALL ALONGBUT IAND I WOULDIF I COULDAND I WOULD WISH IT AWAYWISH IT AWAYWISH IT ALL AWAYI WANNA WISH IT ALL AWAYNO PRIZE YOU COULD HOLD SWAY OR JUSTIFY MY GIVING AWAY MY CENTERSO IF I COULD ID WISH IT ALL AWAY IF I THOUGHT TOMORROW WOULD TAKE YOU AWAYYOUR MY PIECE OF MIND MY ALL MY CENTER IM JUST TRYING TO HOLD ON ONE MORE DAYDAMN MY EYESDIM MY EYESDIM MY EYES IF THEY SHOULD COMPROMISE OUR FULCRUMWANT AND NEED DIVIDE ME THEN I MIGHT AS WELL BE GONESHINE ON FOREVER SHINE ON BENEVOLENT SONSUNSHINE DOWN UPON THE BROKEN SHINE UNTIL THE TWO BECOME ONESHINE ON FOREVER SHINE ON BENEVOLENT SONSUNSHINE DOWN UPON THE SEVERED SHINE UNTIL THE TWO BECOME ONEDIVIDED IM WITHERING AWAYDIVIDED IM WITHERING AWAYSHINE DOWN UPON THE MANY LIGHT OUR WAY BENEVOLENT SONSUNBREATHE IN UNION BREATHE IN UNION BREATHE IN UNION BREATHE IN UNIONBREATHE IN UNION SO AS ONE SURVIVE ANOTHER DAY AND SEASONSILENCE LEECH AND SAVE YOUR PRAYERS SILENCE LEECH JUST STAY OUT OF MY WAY
TOOL,SOME SAY THE END IS NEARSOME SAY WELL SEE ARMAGEDDON SOONI CERTAINLY HOPE WE WILLI SURE COULD USE A VACATION FROM THISBULLSHIT THREE RINGCIRCUS SIDESHOW OFFREAKS HERE IN THISHOPELESS FUCKINGHOLE WE CALL LATHE ONLY WAY TO FIX IT ISTO FLUSH IT ALL AWAYANY FUCKING TIMEANY FUCKING DAYLEARN TO SWIMSEE YOU DOWN INARIZONA BAYFRET FOR YOUR FIGUREAND FRET FOR YOUR LATTEAND FRET FOR YOUR LAWSUITAND FRET FOR YOUR HAIRPIECEAND FRET FOR YOUR PROZACAND FRET FOR YOUR PILOTAND FRET FOR YOUR CONTRACTAND FRET FOR YOUR CARITS A BULLSHIT THREE RINGCIRCUS SIDESHOW OFFREAKS HERE IN THISHOPELESS FUCKINGHOLE WE CALL LATHE ONLY WAY TO FIX IT ISTO FLUSH IT ALL AWAYANY FUCKING TIMEANY FUCKING DAYLEARN TO SWIMSEE YOU DOWN INARIZONA BAYSOME SAY A COMET WILL FALL FROM THE SKYFOLLOWED BY METEOR SHOWERS AND TIDAL WAVESFOLLOWED BY FAULT LINES THAT CANNOT SIT STILLFOLLOWED BY MILLIONS OF DUMBFOUNDED DIPSHITSSOME SAY THE END IS NEARSOME SAY WELL SEE ARMAGEDDON SOONI CERTAINLY HOPE WE WILLI SURE COULD USE A VACATION FROM THISSTUPID SHITSILLY SHITSTUPID SHITONE GREAT BIG FESTERING NEON DISTRACTIONIVE A SUGGESTION TO KEEP YOU ALL OCCUPIEDLEARN TO SWIM LEARN TO SWIM LEARN TO SWIMMOMS GONNA FIX IT ALL SOONMOMS COMING ROUND TO PUT IT BACK THE WAY IT OUGHTA BELEARN TO SWIM LEARN TO SWIM LEARN TO SWIM LEARN TO SWIMFUCK L RON HUBBARDAND FUCK ALL HIS CLONESFUCK ALL THESE GUNTOTINGHIP GANGSTER WANNABESLEARN TO SWIM LEARN TO SWIM LEARN TO SWIM LEARN TO SWIMFUCK RETRO ANYTHINGFUCK YOUR TATTOOSFUCK ALL YOU JUNKIESAND FUCK YOUR SHORT MEMORYLEARN TO SWIM LEARN TO SWIM LEARN TO SWIM LEARN TO SWIMFUCK SMILEY GLADHANDS WITH HIDDEN AGENDASFUCK THESE DYSFUNCTIONAL INSECURE ACTRESSESLEARN TO SWIM LEARN TO SWIM LEARN TO SWIM LEARN TO SWIMIM PRAYING FOR RAINIM PRAYING FOR TIDAL WAVESI WANNA SEE THE GROUND GIVE WAYI WANNA WATCH IT ALL GO DOWNMOM PLEASE FLUSH IT ALL AWAYI WANNA SEE IT GO RIGHT IN AND DOWNI WANNA WATCH IT GO RIGHT INWATCH YOU FLUSH IT ALL AWAYYEAH TIME TO BRING IT DOWN AGAINYEAH DONT JUST CALL A PESSIMISTTRY AND READ BETWEEN THE LINESAND I CANT IMAGINE WHY YOU WOULDNTWELCOME ANY CHANGE MY FRIENDI WANNA SEE IT COME DOWNPLUG IT DOWNSUCK IT DOWNFLUSH IT DOWN
TOOL,BLACK THEN WHITE ARE ALL I SEE IN MY INFANCYRED AND YELLOW THEN CAME TO BE REACHING OUT TO MELETS ME SEEAS BELOW SO ABOVE AND BEYOND I IMAGINEDRAWN BEYOND THE LINES OF REASONPUSH THE ENVELOPE WATCH IT BENDOVER THINKING OVER ANALYZING SEPARATES THE BODY FROM THE MINDWITHERING MY INTUITION MISSING OPPORTUNITIES AND I MUSTFEED MY WILL TO FEEL MY MOMENT DRAWING WAY OUTSIDE THE LINESBLACK THEN WHITE ARE ALL I SEE IN MY INFANCYRED AND YELLOW THEN CAME TO BE REACHING OUT TO MELETS ME SEETHERE IS SO MUCH MORE THATBECKONS ME TO LOOK THROUGH TO THESE INFINITE POSSIBILITIESAS BELOW SO ABOVE AND BEYOND I IMAGINEDRAWN OUTSIDE THE LINES OF REASONPUSH THE ENVELOPE WATCH IT BENDOVER THINKING OVER ANALYZING SEPARATES THE BODY FROM THE MINDWITHERING MY INTUITION LEAVING OPPORTUNITIES BEHINDFEED MY WILL TO FEEL THIS MOMENT URGING ME TO CROSS THE LINEREACHING OUT TO EMBRACE THE RANDOMREACHING OUT TO EMBRACE WHATEVER MAY COMEI EMBRACE MY DESIRE TOEMBRACE MY DESIRE TOFEEL THE RHYTHM TO FEEL CONNECTED ENOUGH TO STEP ASIDE AND WEEP LIKE A WIDOWTO FEEL INSPIRED TO FATHOM THE POWER TO WITNESS THE BEAUTYTO BATHE IN THE FOUNTAINTO SWING ON THE SPIRALTO SWING ON THE SPIRALTO SWING ON THE SPIRAL OF OUR DIVINITY AND STILL BE A HUMANWITH MY FEET UPON THE GROUND I MOVE MYSELF BETWEEN THE SOUNDS AND OPEN WIDE TO SUCK IT INI FEEL IT MOVE ACROSS MY SKINIM REACHING UP AND REACHING OUT IM REACHING FOR THE RANDOM OR WHATEVER WILL BEWILDER MEWHATEVER WILL BEWILDER MEAND FOLLOWING OUR WILL AND WIND WE MAY JUST GO WHERE NO ONES BEENWELL RIDE THE SPIRAL TO THE END AND MAY JUST GO WHERE NO ONES BEENSPIRAL OUT KEEP GOINGSPIRAL OUT KEEP GOINGSPIRAL OUT KEEP GOINGSPIRAL OUT KEEP GOING
TOOL,IT TOOK SO LONG TO REMEMBER JUST WHAT HAPPENEDI WAS SO YOUNG AND VESTAL THENYOU KNOW IT HURT MEBUT IM BREATHING SO I GUESS IM STILL ALIVEEVEN IF SIGNS SEEM TO TELL ME OTHERWISEIVE GOT MY HANDS BOUNDAND MY HEAD DOWN AND MY EYES CLOSEDMY THROATS WIDE OPENI DO UNTO OTHERS WHAT HAS BEEN DONE TO MEDO UNTO OTHERS WHAT HAS BEEN DONE TO YOUIM TREADING WATERI NEED TO SLEEP A WHILEMY LAMB AND MARTYRYOU LOOK SO PRECIOUSWONT YOU WONT YOU COME A BIT CLOSERCLOSE ENOUGH SO I CAN SMELL YOUI NEED YOU TO FEEL THISI CANT STAND TO BURN TOO LONGRELEASED IN SODOMYFOR ONE SWEET MOMENT I AM WHOLEDO UNTO YOU NOW WHAT HAS BEEN DONE TO MEDO UNTO YOU NOW WHAT HAS BEEN DONEYOURE BREATHING SO I GUESS YOURE STILL ALIVEEVEN IF SIGNS SEEM TO TELL ME OTHERWISEWONT YOU WONT YOU COME JUST A BIT CLOSERCLOSE ENOUGH SO I CAN SMELL YOUI NEED YOU TO FEEL THISI NEED THIS TO MAKE ME WHOLERELEASE IN THIS SODOMYFOR I AM YOUR WITNESS THATBLOOD AND FLESH CAN BE TRUSTEDI AM YOUR WITNESS THATBLOOD AND FLESH CAN BE TRUSTEDAND ONLY THIS ONE HOLY MEDIUM BRINGS ME PIECE OF MINDGOT YOUR HANDS BOUND YOUR HEAD DOWNYOUR EYES CLOSEDYOU LOOK SO PRECIOUS NOWI HAVE FOUND SOME KIND OF TEMPORARY SANITY IN THISSHIT BLOOD AND CUM ON MY HANDSIVE COME ROUND FULL CIRCLEMY LAMB AND MARTYR THIS WILL BE OVER SOONYOU LOOK SO PRECIOUSYOU LOOK SO PRECIOUSYOU LOOK SO PRECIOUSYOU LOOK SO PRECIOUS NOWYOU LOOK SO PRECIOUS
TOOL,SO FAMILIARAND OVERWHELMINGLY WARMTHIS ONE THIS FORM I HOLD NOWEMBRACING YOU THIS REALITY HERETHIS ONE THIS FORM I HOLD NOWSO WIDEEYED AND HOPEFULWIDEEYED AND HOPEFULLY WILDWE BARELY REMEMBERWHAT CAME BEFORE THIS PRECIOUS MOMENTCHOOSING TO BE HERERIGHT NOWHOLD ON STAY INSIDETHIS BODY HOLDING MEREMINDING ME THAT I AM NOT ALONE INTHIS BODY MAKES ME FEELETERNAL ALL THIS PAIN IS AN ILLUSION
TOOL,ANGELS ON THE SIDELINEPUZZLED AND AMUSEDWHY DID FATHER GIVE THESE HUMANS FREE WILLNOW THEYRE ALL CONFUSEDDONT THESE TALKING MONKEYS KNOW THAT EDEN HAS ENOUGH TO GO AROUNDPLENTY IN THIS HOLY GARDEN SILLY MONKEYSWHERE THERES ONE THEYRE BOUND TO DIVIDERIGHT IN TWOANGELS ON THE SIDELINEBAFFLED AND CONFUSEDFATHER BLESSED THEM ALL WITH REASONAND THIS IS WHAT THEY CHOOSEMONKEY KILLING MONKEY KILLING MONKEYOVER PIECES OF THE GROUNDSILLY MONKEYS GIVE THEM THUMBSTHEY FORGE A BLADEAND WHERE THERES ONE THEYRE BOUND TO DIVIDERIGHT IN TWORIGHT IN TWOMONKEY KILLING MONKEY KILLING MONKEYOVER PIECES OF THE GROUNDSILLY MONKEYS GIVE THEM THUMBSTHEY MAKE A CLUBAND BEAT THEIR BROTHER DOWNHOW THEY SURVIVE SO MISGUIDED IS A MYSTERYREPUGNANT IS A CREATURE WHO WOULD SQUANDERTHE ABILITY TO LIFT AN EYE TO HEAVEN CONSCIOUS OF HIS FLEETING TIME HERECUTTING OUR LOVE RIGHT IN TWOCUTTING OUR LOVE RIGHT IN TWOCUTTING OUR LOVE RIGHT IN TWOCUTTING OUR LOVE RIGHT IN TWOFIGHT OVER THE CLOUDS OVER WIND OVER SKYFIGHT OVER LIFE OVER BLOOD OVER AIRFIGHT OVER LOVE OVER SUN OVER ANOTHERFIGHT EACH OTHER OVER LIES ANDANGELS ON THE SIDELINE AGAINBEEN SO LONG WITH PATIENCE AND REASONANGELS ON THE SIDELINE AGAINWONDERING WHEN THIS TUG OF WAR WILL ENDCUTTING OUR LOVE RIGHT IN TWOCUTTING OUR LOVE RIGHT IN TWOCUTTING OUR LOVE RIGHT IN TWORIGHT IN TWORIGHT IN TWO
TOOL,HE HAD A LOT TO SAYHE HAD A LOT OF NOTHING TO SAYWELL MISS HIMWELL MISS HIMHE HAD A LOT TO SAYHE HAD A LOT OF NOTHING TO SAYWELL MISS HIMWELL MISS HIMWERE GONNA MISS HIMWERE GONNA MISS HIMWELL SO LONG NOWWE WISH YOU WELLYOU TOLD US HOW YOU WERENT AFRAID TO DIEWELL SO LONGDONT CRYOR FEEL TOO DOWNNOT ALL MARTYRS SEE DIVINITYBUT AT LEAST YOU TRIEDSTANDING ABOVE THE CROWDHE HAD A VOICE THAT WAS STRONG AND LOUDWELL MISS HIMILL MISS HIMRANTING AND POINTING HIS FINGERAT EVERYTHING BUT HIS HEARTWELL MISS HIMILL MISS HIMWERE GONNA MISS HIMWERE GONNA MISS HIMTHERES NO WAYTO RECALLWHAT IT WAS THAT YOU HAD SAID TO MELIKE I CARE AT ALLBUT IT WAS SO LOUDYOU SURE COULD YELLYOU TOOK A STAND ON EVERY LITTLE THINGAND SO LOUDSTANDING ABOVE THE CROWDHE HAD A VOICE THAT WAS STRONG AND LOUD AND ISWALLOWED HIS FACADE CAUSE IM SOEAGER TO IDENTIFY WITHSOMEONE ABOVE THE GROUNDSOMEONE WHO SEEMED TO FEEL THE SAMESOMEONE PREPARED TO LEAD THE WAY ANDSOMEONE WHO WOULD DIE FOR MEWILL YOUWILL YOU NOWWOULD YOU DIE FOR MEDONT YOU FUCKIN LIEDONT YOU STEP OUTTA LINEDONT YOU STEP OUTTA LINEDONT YOU STEP OUTTA LINEDONT YOU FUCKIN LIEYOUVE CLAIMED ALL THIS TIMETHAT YOU WOULD DIE FOR MEWHY THEN ARE YOU SO SURPRISEDWHEN YOU HEAR YOUR OWN EULOGYHE HAD A LOT TO SAYHE HAD A LOT OF NOTHING TO SAYHE HAD A LOT TO SAYHE HAD A LOT OF NOTHING TO SAYCOME DOWNGET OFF YOUR FUCKIN CROSSWE NEED THE FUCKIN SPACETO NAIL THE NEXT FOOL MARTYRTO ASCEND YOU MUST DIEYOU MUST BE CRUCIFIEDFOR OUR SINS AND OUR LIESGOODBYE
TOOL,WEAR THE GRUDGE LIKE A CROWNOF NEGATIVITYCALCULATE WHAT WE WILLOR WILL NOT TOLERATEDESPERATE TO CONTROLALL AND EVERYTHINGUNABLE TO FORGIVEYOUR SCARLET LETTERMANCLUTCH IT LIKE A CORNERSTONEOTHERWISE IT ALL COMES DOWNJUSTIFY DENIALS ANDGRIP EM TO THE LONESOME ENDCLUTCH IT LIKE A CORNERSTONEOTHERWISE IT ALL COMES DOWNTERRIFIED OF BEING WRONGULTIMATUM PRISON CELLSATURN ASCENDSCHOOSE ONE OR TENHANG ON OR BEHUMBLED AGAINHUMBLED AGAINCLUTCH IT LIKE A CORNERSTONEOTHERWISE IT ALL COMES DOWNJUSTIFY DENIALS ANDGRIP EM TO THE LONESOME ENDSATURN ASCENDSCOMES ROUND AGAINSATURN ASCENDSTHE ONE THE TENIGNORANT TOTHE DAMAGE DONEWEAR THE GRUDGE LIKE A CROWNOF NEGATIVITYCALCULATE WHAT YOU WILLOR WILL NOT TOLERATEDESPERATE TO CONTROLALL AND EVERYTHINGUNABLE TO FORGIVEYOUR SCARLET LETTERMANWEAR THE GRUDGE LIKE A CROWNDESPERATE TO CONTROLUNABLE TO FORGIVEAND SINKING DEEPERDEFININGCONFININGSINKING DEEPERCONTROLLINGDEFININGAND WERE SINKING DEEPERSATURN COMES BACK AROUNDTO SHOW YOU EVERYTHINGLETS YOU CHOOSE WHAT YOU WILLWILL NOT SEE AND THENDRAGS YOU DOWN LIKE A STONEOR LIFTS YOU UP AGAINSPITS YOU OUT LIKE A CHILDLIGHT AND INNOCENTSATURN COMES BACK AROUNDLIFTS YOU UP LIKE A CHILDOR DRAGS YOU DOWN LIKE A STONETO CONSUME YOU TIL YOUCHOOSE TOLET THIS GOCHOOSE TOLET THIS GOGIVE AWAY THE STONELET THE OCEAN TAKE AND TRANSMUTATETHIS COLD AND FATED ANCHORGIVE AWAY THE STONELET THE WATERS KISS AND TRANSMUTATETHESE LEADEN GRUDGES INTO GOLDGOLD GOLD GOLD GOLD GOLDGOLD GOLD GOLD GOLDLET GOLET GO
TOOL,ALRIGHTY THEN PICTURE THIS IF YOU WILL TO AM X YOGI DMT AND A BOX OF KRISPY KREMESIN MY NEED TO KNOW POSE JUST OUTSIDE OF AREA CONTEMPLATING THE WHOLE CHOSEN PEOPLE THINGYWHEN A FLAMING STEALTH BANANA SPLIT THE SKYLIKE ONE WOULD HOPE BUT NEVER REALLY EXPECTTO SEE IN A PLACE LIKE THISCUTTING RIGHT ANGLE DONUTS ON A DIMEAND STOPPING RIGHT AT MY BIRKENSTOCKSAND ME YELPINGHOLY FUCKING SHITTHEN THE XFILES BEINGLOOKING LIKE SOME KIND OF BLUEGREEN JACKIE CHANWITH ISABELLA ROSSELLINI LIPS AND BREATH THAT REEKED OFVANILLA CHIG CHAMPADID A SLOWMO MATRIX DESCENTOUTTA THE BUTT END OF THE BANANA VESSELAND HOVERED ABOVE MY BUGEYES MY GAPING JAWAND MY SWEATY L RON HUBBARD UPPER LIPAND ALL I COULD THINK WASI HOPE UNCLE MARTIN HERE DOESNT NOTICETHAT I PISSED MY FUCKIN PANTSSO LIGHT IN HIS WAYLIKE AN APPARITION THATHE HAD ME CRYING OUTFUCK MEITS GOTTA BETHE DEADHEAD CHEMISTRYTHE BLOTTER GOT RIGHT ON TOP OF MEGOT ME SEEIN EMOTHERFUCKINTAND AFTER CALMING ME DOWNWITH SOME ORANGE SLICESAND SOME FETAL SPOONINGET REVEALED TO ME HIS SINGULAR PURPOSEHE SAID YOU ARE THE CHOSEN ONETHE ONE WHO WILL DELIVER THE MESSAGEA MESSAGE OF HOPE FOR THOSE WHO CHOOSE TO HEAR ITAND A WARNING FOR THOSE WHO DO NOTME THE CHOSEN ONETHEY CHOSE MEAND I DIDNT EVEN GRADUATE FROM FUCKIN HIGH SCHOOLYOUD BETTERYOUD BETTERYOUD BETTERYOUD BETTER LISTENTHEN HE LOOKED RIGHT THROUGH MEWITH SOMNIFEROUS ALMOND EYESDONT EVEN KNOW WHAT THAT MEANSMUST REMEMBER TO WRITE IT DOWNTHIS IS SO REALLIKE THE TIME DAVE FLOATED AWAYSEE MY HEART IS POUNDINGCAUSE THIS SHIT NEVER HAPPENS TO MEI CANT BREATHE RIGHT NOWIT WAS SO REALLIKE I WOKE UP IN WONDERLANDALL SORTA TERRIFYINGI DONT WANNA BE ALL ALONEWHILE I TELL THIS STORYAND CAN ANYONE TELL ME WHYYALL SOUND LIKE PEANUTS PARENTSWILL I EVER BE COMING DOWNTHIS IS SO REALFINALLY ITS MY LUCKY DAYSEE MY HEART IS RACINGCAUSE THIS SHIT NEVER HAPPENS TO MEI CANT BREATHE RIGHT NOWYOU BELIEVE ME DONT YOUPLEASE BELIEVE WHAT IVE JUST SAIDSEE THE DEAD AINT TOURINGAND THIS WASNT ALL IN MY HEADSEE THEY TOOK ME BY THE HANDAND INVITED ME RIGHT INTHEN THEY SHOWED ME SOMETHINGI DONT EVEN KNOW WHERE TO BEGINSTRAPPED DOWN TO MY BEDFEET COLD AND EYES REDIM OUT OF MY HEADAM I ALIVE AM I DEADCANT REMEMBER WHAT THEY SAIDGOD DAMN SHIT THE BEDHEY OVERWHELMED AS ONE WOULD BE PLACED IN MY POSITIONSUCH A HEAVY BURDEN NOW TO BE THE ONEBORN TO BEAR AND BRING TO ALL THE DETAILS OF OUR ENDINGTO WRITE IT DOWN FOR ALL THE WORLD TO SEEBUT I FORGOT MY PENSHIT THE BED AGAIN TYPICALSTRAPPED DOWN TO MY BEDFEET COLD AND EYES REDIM OUT OF MY HEADAM I ALIVE AM I DEADSUN KISSED AND SUDAFEDGYROSCOPES AND INFRAREDWONT HELP IM BRAIN DEADCANT REMEMBER WHAT THEY SAIDGOD DAMN SHIT THE BEDI CANT REMEMBER WHAT THEY SAID TO MECANT REMEMBER WHAT THEY SAID TO MAKE ME OUT TO BE THE HEROCANT REMEMBER WHAT THEY SAIDBOB HELP MECANT REMEMBER WHAT THEY SAIDWE DONT KNOW AND WE WONT KNOW XGOD DAMN SHIT THE BED
TOOL,I MET A BOYWEARING VANS SAND A DOPE BEASTIE TEE NIPPLE RINGS NEW TATTOOS THAT CLAIMED THAT HEWAS OGTAFTER FROM THE FIRST EPAND IN BETWEENSIPS OF COKEHE TOLD ME THATHE THOUGHTWE WERE SELLIN OUTLAYIN DOWNSUCKIN UPTO THE MANWELL NOW IVE GOT SOMEADVICE FOR YOU LITTLE BUDDYBEFORE YOU POINT THE FINGERYOU SHOULD KNOW THAT IM THE MANIF IM THE MANTHEN YOURE THE MANAND HES THE MAN AS WELLSO YOU CAN POINT THAT FUCKIN FINGER UP YOUR ASSALL YOU KNOW ABOUT ME IS WHAT IVE SOLD YOUDUMB FUCKI SOLD OUT LONG BEFORE YOU EVER EVEN HEARD MY NAMEI SOLD MY SOUL TO MAKE A RECORDDIP SHITAND THEN YOU BOUGHT ONEIVE GOT SOMEADVICE FOR YOU LITTLE BUDDYBEFORE YOU POINT YOUR FINGERYOU SHOULD KNOW THAT IM THE MANIF IM THE FUCKIN MANTHEN YOURE THE FUCKIN MAN AS WELLSO YOU CAN POINT THAT FUCKIN FINGER UP YOUR ASSALL YOU KNOW ABOUT ME IS WHAT IVE SOLD YOUDUMB FUCKI SOLD OUT LONG BEFORE YOU EVER EVEN HEARD MY NAMEI SOLD MY SOUL TO MAKE A RECORDDIP SHITAND THEN YOU BOUGHT ONEALL YOU READ ANDWEAR OR SEE ANDHEAR ON TVIS A PRODUCTBEGGING FOR YOURFATASS DIRTYDOLLARSHUT UP ANDBUY BUY BUY MY NEW RECORDBUY BUY BUYSEND MORE MONEYFUCK YOU BUDDYFUCK YOU BUDDYFUCK YOU BUDDYFUCK YOU BUDDY
TOOL,INSTRUMENTAL
TOOL,FUCK YOUI CANT SAY WHAT I WANT TOEVEN IF IM NOT SERIOUSI CANT SAY WHAT I WANT TOEVEN IF IM NOT SERIOUSTHINGS LIKEGO FUCK YOURSELFGO FUCK YOURSELFYOU PIECE OF SHITWHY DONT YOU JUST GO AND KILL YOURSELFI SAIDI CANT SAY WHAT I WANT TOEVEN IF IM NOT SERIOUSI CANT SAY WHAT I WANT TOEVEN IF IM JUST KIDDINGPEOPLE TELL ME WHAT TO SAYWHAT TO THINK AND WHAT TO PLAYI SAIDPEOPLE TELL ME WHAT TO SAYWHAT TO THINK AND WHAT TO PLAYI SAIDFUCK YOURSELFFUCK YOURSELFYOU PIECE OF SHITWHY DONT YOU JUST GO AND KILL YOURSELFI SAIDI CANT SAY WHAT I WANT TOEVEN IF IM NOT SERIOUSI CANT SAY WHAT I WANT TOEVEN IF IM JUST KIDDINGGO FUCK YOURSELFGO FUCK YOURSELFYOU PIECE OF SHITWHY DONT YOU GO FUCK YOURSELFPEOPLE TELL ME WHAT TO SAYWHAT TO THINK AND WHAT TO PLAYI SAIDPEOPLE TELL ME WHAT TO SAYWHAT TO THINK AND WHAT TO PLAYJUST KIDDINGJUST KIDDINGJUST KIDDING
TOOL,MY WARNING MEANT NOTHINGYOURE DANCING IN QUICKSANDWHY DONT YOU WATCH WHERE YOURE WANDERINGWHY DONT YOU WATCH WHERE YOURE STUMBLINGYOURE WADING KNEE DEEP AND GOING INYOURE WADING KNEE DEEP AND GOING INTHIS BOG IS THICK ANDEASY TO GET LOST INCAUSE YOURE A STUPIDBELLIGERENT FUCKERTHIS BOG IS THICK ANDEASY TO GET LOST INCAUSE YOURE A DUMBASSBELLIGERENT FUCKERI HOPE IT SUCKS YOU DOWNDOWNDOWNDOWNMY WARNING MEANT NOTHINGYOURE DANCING IN QUICKSANDWHY DONT YOU WATCH WHERE YOURE WANDERINGWHY DONT YOU WATCH WHERE YOURE STUMBLINGYOURE WADING KNEE DEEP AND GOING INAND YOU MAY NEVER COME BACK AGAINTHIS BOG IS THICK ANDEASY TO GET LOST INCAUSE YOURE A STUPIDBELLIGERENT FUCKERTHIS BOG IS THICK ANDEASY TO GET LOST INCAUSE YOURE A DUMBASSBELLIGERENT FUCKERI HOPE IT SUCKS YOU DOWNMY WARNING MEANT NOTHINGYOURE DANCING IN QUICKSANDWHY DONT YOU WATCH WHERE YOURE WANDERINGWHY DONT YOU WATCH WHERE YOURE STUMBLINGYOURE WADING KNEE DEEP AND GOING INAND YOU MAY NEVER COME BACK AGAINTHIS BOG IS THICK ANDEASY TO GET LOST INCAUSE YOURE A STUPIDBELLIGERENT FUCKERTHIS BOG IS THICK ANDEASY TO GET LOST INCAUSE YOURE A DUMBASSBELLIGERENT FUCKERI HOPE IT SUCKSI HOPE IT SUCKSI HOPE IT SUCKS YOU FUCKERI HOPE IT SUCKSI HOPE IT SUCKSI HOPE IT SUCKS YOU DOWNWANDERING WANDERINGNO ONE EVEN INVITED YOU INSTILL STUMBLINGSUFFOCATE SUFFOCATEWHY DONT YOU GET AWAYWANDERING AROUND AND WANDERINGNO ONE EVEN INVITED YOU INYOURE STILL STUMBLINGSUFFOCATE SUFFOCATEWHY DONT YOU GET OUT WHILE YOU CANNO ONE TOLD YOU TO COMEMY WARNING MEANT NOTHINGYOURE DANCING IN QUICKSANDWHY DONT YOU WATCH WHERE YOURE WANDERINGWHY DONT YOU WATCH WHERE YOURE STUMBLINGYOURE WADING KNEE DEEP AND GOING INAND YOU MAY NEVER COME BACK AGAINTHIS BOG IS THICK ANDEASY TO GET LOST INCAUSE YOURE A STUPIDBELLIGERENT FUCKERTHIS BOG IS THICK ANDEASY TO GET LOST INCAUSE YOURE A DUMBASSBELLIGERENT FUCKERI HOPE IT SUCKSI HOPE IT SUCKSI HOPE IT SUCKS YOU FUCKERI HOPE IT SUCKSI HOPE IT SUCKSI HOPE IT SUCKS YOU
TOOL,I KNOW YOU WELLYOU ARE A PART OF MEI KNOW YOU BETTER THAN I KNOW MYSELFI KNOW YOU BEST BETTER THAN ANYONEI KNOW YOU BETTER THAN I KNOW MYSELFYOU ARE A PART OF MEYOU ARE JUST A PART OF MEYOU ARE JUST A PART OF MEYOU ARE JUST A PART OF MEYOU ARE JUST A PART OF MEGIVE IT UPYOU DONT SPEAKYOU DONT JUDGEYOU CANT LEAVEYOU CANT HURT MEYOURE JUST HERE FOR ME TO USEI KNOW YOU WELL YOU ARE A PART OF MEI KNOW YOU BETTER THAN I KNOW MYSELFI KNOW YOU BEST BETTER THAN ANYONEI KNOW YOU BETTER THAN I KNOW MYSELFI KNOW YOU WELL BETTER THAN ANYONE MIGHT THINKI KNOW YOU BETTER THAN I KNOW MYSELFI KNOW YOU WELL YOU ARE A PART OF MEI KNOW YOU BEST BETTER THAN ANYONEI KNOW YOU WELL YOU ARE A PART OF MEI KNOW YOU BEST BETTER THAN ONE MIGHT THINKITS TIME FOR YOU TO MAKE A SACRIFICEITS TIME TO DIE A LITTLEGIVE IT UPI KNOW YOU BEST BETTER THAN ANYONEI KNOW YOU BETTER THAN I KNOW MYSELFA PART OF ME
