Artist,Track
Eminem,CHORUSTHE WAY YOU SHAKE IT I CANT BELIEVE ITI AINT NEVER SEEN AN ASS LIKE THATTHE WAY YOU MOVE IT YOU MAKE MY PEE PEE GODOING DOING DOINGI DONT BELIEVE IT ITS ALMOST TOO GOOD TO BE TRUEI AINT NEVER SEEN AN ASS LIKE THATTHE WAY YOU MOVE IT YOU MAKE MY PEE PEE GODOING DOING DOINGTHE WAY SHE MOVES SHES LIKE A BELLY DANCERSHES SHAKING THAT ASS TO THAT NEW NELLY JAM ITHINK SOMEONES AT THE DOORBUT I DONT THINK IM GONNA ANSWERPOLICE SAYING FREEZEDOING DOING DOINGWHAT DO YOU MEAN FREEZEPLEASE IM A HUMAN BEING I HAVE NEEDSIM NOT DONE NOT TILL IM FINISH PEEINGI AM NOT RESISTING ARREST I AM AGREEING MR OFFICERIM ALREADY ON MY KNEESI CANT GET ON THE GROUND ANY FURTHER ITS IMPOSSIBLE FOR MEAND DO NOT TREAT ME LIKE A MURDERER I JUST LIKE TO PEE PEE PEEYES I MAKE RB I SING SONG IT GORINGACHONG ACHINGCHONGCHONGCHONGCHINGPSYCH I JOKE I JOKE I KIDD I KIDDIF I OFFEND IM SORRY PLEASE PLEASE FORGIVEFOR I AM TRIUMPH THE PUPPET DOG I AM A MERE PUPPETI CAN GET AWAY WITH ANYTHING I SING YOU WILL LOVE ITCHORUSTHE WAY YOU SHAKE IT I CANT BELIEVE ITI AINT NEVER SEEN AN ASS LIKE THATTHE WAY YOU MOVE IT YOU MAKE MY PEE PEE GODOING DOING DOINGJESSICA SIMPSON LOOKS OH SO TEMPTINNICK I AINT NEVER SEEN AN ASS LIKE THATEVERYTIME I SEE THAT SHOW ON MTV MY PEE PEE GOESDOING DOING DOINGMARYKATE AND ASHLEY USED TO BE SO WHOLESOMENOW THEYRE GETTING OLDER THEYRE STARTING TO GROW BUM BUMSI GO TO THE MOVIES AND SIT DOWN WITH MY POP CORNPOLICE SAYING FREEZEDOING DOING DOINGWHAT DO YOU MEAN FREEZEGEEZ I JUST GOT MY SEATI HAVE TICKET LOOK I PUT AWAY MY ZIPPERS ZIPPEDPLEASE DO NOT REMOVE ME FROM THIS MOVIE THEATER PLEASEI DID NOT EVEN GET TO SEE MARYKATE SHOWER SCENEI DIDNT MEAN TO BE OBSCENE OR MAKE A GREAT BIG SCENEAND DONT TREAT ME LIKE IM PEE WEE HERMAN THIS MOVIES PGMR OFFICER I DEMAND TO SEE MY ATTORNEYI WILL SIMPLY PLEAD INNOCENT COP A PLEA AND BE FREEFREE YES FREE RIGHT BACK ON THE STREETSWHAT YOU MEAN MY LAWYERS WITH MICHAEL HES TOO BUSYI AM TRIUMPH BRITNEY SPEARS HAS SHOULDERS LIKE A MANAND I CAN SAY THAT AND YOULL LAUGH CUZ THAT IS A PUPPET ON MY HANDCHORUSTHE WAY YOU SHAKE IT I CANT BELIEVE ITI AINT NEVER SEEN AN ASS LIKE THATTHE WAY YOU MOVE IT YOU MAKE MY PEE PEE GODOING DOING DOINGHILARY DUFF IS NOT QUITE OLD ENOUGH SOI AINT NEVER SEEN A BUTT LIKE THATMAYBE NEXT YEAR ILL SAY ASS AND SHELL MAKE MY PEE PEE GODOING DOING DOINGTHE WAY SHE MOVES SHE DANCES LIKE A GOGOIN THAT VIDEO SHE SINGS GET OUT YOUR POLES SOI NEED A NEW BOYFRIEND HI MY NAME IS JOJOPOLICE SAYING FREEZEDOING DOING DOINGWHAT DO YOU MEAN FREEZEMY COMPUTERS WOULD BE SEIZED AND MY KEYS TO MY RANCHI JUST BAKED COOKIES MR OFFICER LOOKY TAKE A WHIFF OF THESEHERE I MAKE JESUS JUICE TAKE A SIP OF THISNOBODY IS SAFE FROM ME NO NOT EVEN MEI DONT EVEN KNOW IF I CAN SAY THE WORD PEE PEE PEEON THE RADIO BUT I THINK I DIDJANET IS THAT A BREAST I THINK I JUST SAW A TITPSYCH I JOKE I JOKE I KIDD I KIDDI DONT THINK MY JOKE IS WORKING I MUST FLEE QUICKGET TO THE CHOPPER EVERYBODY GET OUTI AM NOT TRIUMPH I AM ARNOLD GET DOWNCHORUSTHE WAY YOU SHAKE IT I CANT BELIEVE ITI AINT NEVER SEEN AN ASS LIKE THATTHE WAY YOU MOVE IT YOU MAKE MY PEE PEE GODOING DOING DOINGSO GWEN STEFANI WILL YOU PEE PEE ON ME PLEASEI AINT NEVER SEEN AN ASS LIKE THATCUZ THE WAY YOU MOVE IT YOU MAKE MY PEE PEE GODOING DOING DOINGDR DREFUCK IS WRONG WITH YOU HA
Eminem,OK IM GOING TO ATTEMPT TO DROWN MYSELFYOU CAN TRY THIS AT HOMEYOU CAN BE JUST LIKE MEMIC CHECK WE RECORDINGIM CANCEROUS SO WHEN I DISS YOU WOULDNT WANNA ANSWER THISIF YA RESPONDED BACK WITH A BATTLE RAP YOU WROTE FOR CANIBUSILL STRANGLE YOU TO DEATH THEN ILL CHOKE YOU AGAIN ACKTHEN BROKE YOUR FUCKING LEGS TIL YOURBONES POKE THROUGH YOUR SKINAAWWYOU BEEF WITH ME IMA EVEN THE SCORE EQUALLYTAKE YOU ON JERRY SPRINGER AND BEAT YOUR ASS LEGALLYI GET YOU BLUNTED OFF OF FUNNY HOME GROWNCAUSE WHEN I SMOKE OUT I HIT THE TREES HARDER THAN SONNY BONOOH NOAND IF I SAID I NEVER DID DRUGS THAT WOULD MEAN I LIEAND GET FUCKED MORE THAT THE PRESIDENT DOESHILLARY CLINTON TRIED TO SLAP ME AND CALL ME A PERVERTI RIPPED HER FUCKING TONSILS OUT AND FED HER SHERBERT BITCHMY NERVES HURT AND LATELY IM ON EDGE GRABBED VANILLA ICEAND RIPPED OUT HIS BLONDE DREADS FUCKEREVERY GIRL I EVER WENT OUT WITH WAS GOING LEZFOLLOW ME AND DO EXCACTLY WHAT THE SONG SAYSSMOKE WEED TAKE PILLS DROP OUTTA SCHOOL KILL PEOPLE AND DRINKJUMP BEHIND WHEEL LIKE IT WAS STILL LEGALIM DUMB ENOUGH TO WALK IN A STORE AND STEALSO IM DUMB ENOUGH TO ASK A FOR DATE WITH LAURYN HILLSOME PEOPLE ONLY SEE THAT IM WHITE IGNORING SKILLCUZ I STAND OUT LIKE A GREEN HAT WITH AN ORANGE BILLBUT I DONT GET PISSED YALL DONT EVEN SEE THROUGH THE MISTHOW THE FUCK CAN I BE WHITE I DONT EVEN EXISTI GET A CLEAN SHAVE BATHE GO TO A RAVE DIE FROM AN OVERDOSEAND DIG MYSELF UP OUT OF MY GRAVEMY MIDDLE FINGER WONT GO DOWN HOW DO I WAVEAND THIS IS HOW IM SUPPOSED TO TEACH KIDS HOW TO BEHAVENOW FOLLOW ME AND DO EXCACTLY WHAT YOU SEEDONT YOU WANNA GROW UP TO BE JUST LIKE MEI SLAP WOMEN AND EAT SHROOMS THEN ODNOW DONT YOU WANNA GROW UP TO BE JUST LIKE ME ME AND MARCUS ALLEN WENT OVER TO SEE NICOLEWHEN WE HEARD A KNOCK ON THE DOOR KNOCK MUSTVE BEEN RON GOLDJUMPED BEHIND THE DOOR PUT THE ORGY ON HOLDKILLED EM BOTH THEN SMEARED BLOOD ON THE WHITE BRONCO WE DID ITMY MIND WONT WORK AND MY SPINE DONT JERKI SLAPPED GARTH BROOKS OUT OF HIS RHINESTONE SHIRTIM NOT A PLAYER JUST AN ILL RHYME SAYERTHATLL SPRAY AN AEROSOL CAN UP AT THE OZONE LAYER PSSSSSSSHMY RAP STYLES WARPED IM RUNNIN OUT THE MORGUEWITH YOUR DEAD GRANDMOTHERS CORPSE TO THROW IT ON YOUR PORCH SCREAMJUMPED IN A CHICKENHAWK CARTOON WITH A CAPE ONAND BEAT UP FOGHORN LEGHORN WITH AN ACORNIM ABOUT AS NORMAL AS NORMAN BAITES WITH DEFORMATIVE TRAITSA PREMATURE BIRTH THAT WAS FOUR MINUTES LATEMOTHER ARE YOU THERE I LOVE YOU I NEVER MEANT TO HIT YOUOVER THE HEAD WITH THAT SHOVELEVIL LAUGHWILL SOMEONE PLEASE EXPLAIN TO MYBRAIN THAT I JUST SEVERED A MAIN VEINWITH A CHAINSAW AND IM IN PAINI TAKE A BREATHER AND SIGH EITHER IM HIGH OR IM NUTSCAUSE IF YOU AINT TILTIN THIS ROOM NEITHER AM ISO WHEN YOU SEE YOUR MOM WITH A THERMOMETER SHOVED UP HER ASSTHEN ITS PROBABLY OBVIOUS I GOT IT ON WITH HERCAUSE WHEN I DROP THIS SOLO SHIT ITS OVER WITHI BOUGHT CAGES TAPE OPENED IT AND DUBBED OVER ITI CAME TO THE CLUB DRUNK AND WITH A FAKE IDDONT YOU WANNA GROW UP TO BE JUST LIKE MEIVE BEEN WITH WOMEN WHO GOT HIVNOW DONT YOU WANNA GROW UP TO BE JUST LIKE MEI GOT GENITAL WARTS AND IT BURNS WHEN I PEENOW DONT YOU WANNA GROW UP TO BE JUST LIKE MEI TIE A ROPE AROUND MY PENIS AND JUMP FROM A TREEYOU PROBABLY WANNA GROW UP THE JUST LIKE ME
Eminem,ANNOUNCERMEET EDDIE YEARS OLDFED UP WITH LIFEAND THE WAY THINGS ARE GOINGHE DECIDES TO ROB A LIQUOR STOREI CANT TAKE THIS NO MORE I CANT TAKE IT NO MORE HOMESBUT ON HIS WAY INHE HAS A SUDDEN CHANGE OF HEARTAND SUDDENLYHIS CONSCIENCE COMES INTO PLAYDR DREALRIGHT STOP HUHNOW BEFORE YOU WALK IN THE DOOROF THIS LIQUOR STOREAND TRY TO GET MONEY OUT THE DRAWERYOUD BETTER THINK OF THE CONSEQUENCE BUT WHO ARE YOUIM YOUR MOTHERFUCKIN CONSCIENCEEMINEMTHATS NONSENSEGO IN AND GAFFLE THE MONEYAND RUN TO ONE OF YOUR AUNTS CRIBSAND BORROW A DAMN DRESSAND ONE OF HER BLONDE WIGS CAN I BORROW THISTELL HER YOU NEED A PLACE TO STAYYOULL BE SAFE FOR DAYSIF YOU SHAVE YOUR LEGSWITH RENEES RAZOR BLADESDR DREYEAH BUT IF IT ALL GOES THROUGHLIKE ITS SUPPOSED TOTHE WHOLE NEIGHBOURHOOD KNOWS YOUAND THEYLL EXPOSE YOUTHINK ABOUT IT BEFORE YOU WALK IN THE DOOR FIRSTLOOK AT THE STORE CLERKSHES OLDER THEN GEORGE BURNSEMINEMFUCK THATDO THAT SHITSHOOT THAT BITCHCAN YOU AFFORD TO BLOW THIS SHITARE YOU THAT RICHWHY YOU GIVE A FUCK IF SHE DIESARE YOU THAT BITCHDO YOU REALLY THINK SHE GIVES A FUCKIF YOU HAVE KIDSDR DREMAN DONT DO ITITS NOT WORTH ITTO RISK IT YOURE RIGHTNOT OVER THIS SHIT STOPDROP THE BISCUIT I WILLDONT EVEN LISTEN TO SLIM YOHES BAD FOR YOUEMINEMYOU KNOW WHAT DREI DONT LIKE YOUR ATTITUDESOUND OF STATICITS ALL RIGHT CMON JUST COME IN HERE FOR A MINUTEMMM I DONT KNOWLOOK BABYDAMNLOOK ITS GONNA BE ALL RIGHT RIGHTWELL OKAYANNOUNCERMEET STAN YEARS OLD GIVE ME A KISSAFTER MEETING A YOUNG GIRL AT A RAVE PARTYTHINGS START GETTING HOT AND HEAVY IN AN UPSTAIRS BEDROOMONCE AGAIN HIS CONSCIENCE COMES INTO PLAYSHITEMINEMNOW LISTEN TO MEWHILE YOURE KISSIN HER CHEEKAND SMEARIN HER LIPSTICK SLIP THIS IN HER DRINKNOW ALL YOU GOTTA DO IS NIBBLE ON THIS LITTLE BITCHS EARLOBEDR DREYO THIS GIRLS ONLY FIFTEEN YEARS OLDYOU SHOULDNT TAKE ADVANTAGE OF HER ITS NOT FAIREMINEMYO LOOK AT HER BUSHDOES IT GOT HAIR UHHUHFUCK THIS BITCH RIGHT HERE ON THE SPOT BARETILL SHE PASSES OUTAND SHE FORGOT HOW SHE GOT THEREDR DREMAN AINT YOU EVER SEEN THAT ONE MOVIE KIDSEMINEMNO BUT I SEEN THE PORNO WITH SUNDOOBIESTDR DRESHIT YOU WANNA GET HAULED OFF TO JAILEMINEMMAN FUCK THATHIT THAT SHIT RAW DAWG AND BAILSOUND OF STATICPICKUP IDLING RADIO PLAYINGHE IT FEELS GOOD TO BE HOMEANNOUNCERMEET GRADY A YEAROLD CONSTRUCTION WORKERAFTER COMING HOME FROM A HARD DAYS WORKHE WALKS IN THE DOOR OF HIS TRAILER PARK HOMETO FIND HIS WIFE IN BED WITH ANOTHER MANGRADYWHAT THE FUCK WIFEGRADYDR DREALRIGHT CALM DOWNRELAX START BREATHINEMINEMFUCK THAT SHITYOU JUST CAUGHT THIS BITCH CHEATINWHILE YOU AT WORK SHES WITH SOME DUDETRYIN TO GET OFFFUCK SLITTIN HER THROATCUT THIS BITCHS HEAD OFFDR DREWAIT WHAT IF THERES AN EXPLANATION FOR THIS SHITEMINEMWHAT SHE TRIPPED FELL LANDED ON HIS DICKDR DREALRIGHT SHADYMAYBE HES RIGHT GRADYBUT THINK ABOUT THE BABYBEFORE YOU GET ALL CRAZYEMINEMOKAY THOUGHT ABOUT ITSTILL WANNA STAB HERGRAB HER BY THE THROATGET YOURE DAUGHTER AND KIDNAP HERTHATS WHAT I DIDBE SMART DONT BE A RETARDYOU GONNA TAKE ADVICE FROM SOMEBODY WHO SLAPPED DEE BARNESDR DREWHATCHU SAYEMINEMWHATS WRONG DIDNT THINK ID REMEMBERDR DREIMA KILL YOU MOTHERFUCKEREMINEMAHAHTEMPER TEMPERMR DREMR NWAMR AK COMING STRAIGHT OUTTA COMPTONYALL BETTER MAKE WAYHOW IN THE FUCK YOU GONNA TELL THIS MAN NOT TO BE VIOLENTDR DRECUZ HE DONT NEED TO GO THE SAME ROUTE THAT I WENTBEEN THERE DONE THATAW FUCK ITWHAT AM I SAYINSHOOT EM BOTH GRADY WHERES YOUR GUN ATGUN FIRES IS COCKED AND REFIRED
Elton John,YOU COULD NEVER KNOW WHAT ITS LIKEYOUR BLOOD LIKE WINTER FREEZES JUST LIKE ICEAND THERES A COLD AND LONELY LIGHT THAT SHINES FROM YOUYOULL WIND UP LIKE THE WRECK YOU HIDE BEHIND THAT MASK YOU USEAND DID YOU THINK THIS FOOL COULD NEVER WINWELL LOOK AT ME IM COMING BACK AGAINI GOT A TASTE OF LOVE IN A SIMPLE WAYAND IF YOU NEED TO KNOW WHILE IM STILL STANDING YOU JUST FADE AWAYDONT YOU KNOW IM STILL STANDING BETTER THAN I EVER DIDLOOKING LIKE A TRUE SURVIVOR FEELING LIKE A LITTLE KIDIM STILL STANDING AFTER ALL THIS TIMEPICKING UP THE PIECES OF MY LIFE WITHOUT YOU ON MY MINDIM STILL STANDING YEAH YEAH YEAHIM STILL STANDING YEAH YEAH YEAHONCE I NEVER COULD HOPE TO WINYOU STARTING DOWN THE ROAD LEAVING ME AGAINTHE THREATS YOU MADE WERE MEANT TO CUT ME DOWNAND IF OUR LOVE WAS JUST A CIRCUS YOUD BE A CLOWN BY NOWY KNOW IM STILL STANDING BETTER THAN I EVER DIDLOOKING LIKE A TRUE SURVIVOR FEELING LIKE A LITTLE KIDIM STILL STANDING AFTER ALL THIS TIMEPICKING UP THE PIECES OF MY LIFE WITHOUT YOU ON MY MINDIM STILL STANDING YEAH YEAH YEAHIM STILL STANDING YEAH YEAH YEAHSOLODONT YOU KNOW THAT IM STILL STANDING BETTER THAN I EVER DIDLOOKING LIKE A TRUE SURVIVOR FEELING LIKE A LITTLE KIDIM STILL STANDING AFTER ALL THIS TIMEPICKING UP THE PIECES OF MY LIFE WITHOUT YOU ON MY MINDIM STILL STANDING YEAH YEAH YEAHIM STILL STANDING YEAH YEAH YEAHIM STILL STANDING YEAH YEAH YEAHIM STILL STANDING YEAH YEAH YEAHFADE
Elton John,BLUE JEAN BABY LA LADYSEAMSTRESS FOR THE BANDPRETTY EYES PIRATE SMILEYOURE MARRYING MUSIC MANBALLERINA YOU MUSTVE SEEN HERDANCING IN THE SANDAND NOW SHES IN ME ALWAYS WITH METINY DANCER IN MY HANDJESUS FREAKS OUT IN THE STREETHANDING TICKETS OUT FOR GODTURNING BACK SHE JUST LAUGHSTHE BOULEVARD IS NOT THAT BADPIANO MAN HE MAKES HIS STANDIN THE AUDITORIUMLOOKING ON SHE SINGS THE SONGTHE WORDS SHE KNOWSTHE TUNE SHE HUMSBUT OH HOW IT FEELS SO REALLYING HERE WITH NO ONE NEARONLY YOU AND YOU CAN HEAR MEWHEN I SAY SOFTLY SLOWLYHOLD ME CLOSER TINY DANCERCOUNT THE HEADLIGHTS ON THE HIGHWAYLAY ME DOWN IN SHEETS OF LINENYOU HAD A BUSY DAY TODAYREPEATBLUE JEAN BABY LA LADYSEAMSTRESS FOR THE BANDPRETTY EYED PIRATE SMILEYOURE MARRYING A MUSIC MANBALLERINA YOU MUSTVE SEEN HERDANCING IN THE SANDAND NOW SHES IN ME ALWAYS WITH METINY DANCER IN MY HANDBUT OH HOW IT FEELS SO REALLYING HERE WITH NO ONE NEARONLY YOU AND YOU CAN HEAR MEWHEN I SAY SOFTLY SLOWLYREPEAT CHORUS X
Elton John,ITS A LITTLE BIT FUNNY THIS FEELING INSIDEIM NOT ONE OF THOSE WHO CAN EASILY HIDEI DONT HAVE MUCH MONEY BUT BOY IF I DIDID BUY A BIG HOUSE WHERE WE BOTH COULD LIVEIF I WAS A SCULPTOR HEH BUT THEN AGAIN NOOR A MAN WHO MAKES POTIONS IN A TRAVELING SHOWI KNOW ITS NOT MUCH BUT ITS THE BEST I CAN DOMY GIFT IS MY SONG AND THIS ONES FOR YOUAND YOU CAN TELL EVERYBODY THIS IS YOUR SONGIT MAY BE QUITE SIMPLE BUT NOW THAT ITS DONEI HOPE YOU DONT MIND I HOPE YOU DONT MINDTHAT I PUT DOWN IN WORDSHOW WONDERFUL LIFE IS WHILE YOURE IN THE WORLDI SAT ON THE ROOF AND KICKED OFF THE MOSSWELL A FEW ARE THE VERSES WELL THEYTHEYVE GOT ME QUITE CROSSBUT THE SUNS BEEN QUITE KIND WHILE I WROTE THIS SONGITS FOR PEOPLE LIKE YOU THAT KEEP IT TURNED ONSO EXCUSE ME FORGETTING BUT THESE THINGS I DOYOU SEE IVE FORGOTTEN IF THEYRE GREEN OR THEYRE BLUEANYWAY THE THING IS WHAT I REALLY MEANYOURS ARE THE SWEETEST EYES IVE EVER SEENAND YOU CAN TELL EVERYBODY THAT THIS IS YOUR SONGIT MAY BE QUITE SIMPLE BUT NOW THAT ITS DONEI HOPE YOU DONT MIND I HOPE YOU DONT MINDTHAT I PUT DOWN IN WORDSHOW WONDERFUL LIFE IS WHILE YOURE IN THE WORLDI HOPE YOU DONT MIND I HOPE YOU DONT MINDTHAT I PUT DOWN IN WORDSHOW WONDERFUL LIFE IS WHILE YOURE IN THE WORLD
Elton John,ITS A HUMAN SIGNWHEN THINGS GO WRONGWHEN THE SCENT OF HER LINGERSAND TEMPTATIONS STRONGIN TO THE BOUNDARYOF EACH MARRIED MANSWEET DECEIT COMES CALLINAND NEGATIVITY LANDSCOLD COLD HEARTHARD DONE BY YOUSOME THINGS LOOK BETTER BABYJUST PASSIN THROUGHCHORUSAND ITS NO SACRIFICEJUST A SIMPLE WORDITS TWO HEARTS LIVINGIN TWO SEPARATE WORLDSBUT ITS NO SACRIFICENO SACRIFICEITS NO SACRIFICE AT ALLMUTUAL MISUNDERSTANDINGAFTER THE FACTSENSITIVITY BUILDS A PRISONIN THE FINAL ACTWE LOSE DIRECTIONNO STONE UNTURNEDNO TEARS TO DAMN YOUWHEN JEALOUSY BURNSCOLD COLD HEARTHARD DONE BY YOUSOME THINGS LOOK BETTER BABYJUST PASSIN THROUGHREPEAT CHORUSCOLD COLD HEARTHARD DONE BY YOUSOME THINGS LOOK BETTER BABYJUST PASSIN THROUGHREPEAT CHORUSNO SACRIFICE AT ALL X
Elton John,I REMEMBER WHEN ROCK WAS YOUNGME AND SUZIE HAD SO MUCH FUNHOLDING HANDS AND SKIMMING STONESHAD AN OLD GOLD CHEVY AND A PLACE OF MY OWNBUT THE BIGGEST KICK I EVER GOTWAS DOING A THING CALLED THE CROCODILE ROCKWHILE THE OTHER KIDS WERE ROCKING ROUND THE CLOCKWE WERE HOPPING AND BOPPING TO THE CROCODILE ROCKWELL CROC ROCKING IS SOMETHING SHOCKINGWHEN YOUR FEET JUST CANT KEEP STILLI NEVER KNEW ME A BETTER TIME AND I GUESS I NEVER WILLOW LORDIEMAMA THOSE FRIDAY NIGHTSWHEN SUZIE WORE HER DRESSES TIGHT ANDCROCODILE ROCKING WAS OUT OF SIGHTLA LALALALALALALALALALA LALALALALABUT THE YEARS WENT BY AND THE ROCK JUST DIEDSUZIE WENT AND LEFT ME FOR SOME FOREIGN GUYLONG NIGHTS CRYING BY THE RECORD MACHINEDREAMING OF MY CHEVY AND MY OLD BLUE JEANSBUT THEYLL NEVER KILL THE THRILLS WEVE GOTBURNING UP TO THE CROCODILE ROCKLEARNING FAST AS THE WEEKS WENT PASTWE REALLY THOUGHT THE CROCODILE ROCK WOULD LASTWELL CROCODILE ROCKING IS SOMETHING SHOCKINGWHEN YOUR FEET JUST CANT KEEP STILLI NEVER KNEW ME A BETTER TIME AND I GUESS I NEVER WILLOW LORDIEMAMA THOSE FRIDAY NIGHTSWHEN SUZIE WORE HER DRESSES TIGHT ANDCROCODILE ROCKING WAS OUT OF SIGHTLA LALALALALALALALALALA LALALALALAI REMEMBER WHEN ROCK WAS YOUNGME AND SUZIE HAD SO MUCH FUNHOLDING HANDS AND SKIMMING STONESHAD AN OLD GOLD CHEVY AND A PLACE OF MY OWNBUT THE BIGGEST KICK I EVER GOTWAS DOING A THING CALLED THE CROCODILE ROCKWHILE THE OTHER KIDS WERE ROCKING ROUND THE CLOCKWE WERE HOPPING AND BOPPING TO THE CROCODILE ROCKWELL CROCODILE ROCKING IS SOMETHING SHOCKINGWHEN YOUR FEET JUST CANT KEEP STILLI NEVER KNEW ME A BETTER TIME AND I GUESS I NEVER WILLOW LAWDYMAMA THOSE FRIDAY NIGHTSWHEN SUZIE WORE HER DRESSES TIGHTAND THE CROCODILE ROCKING WAS OUT OF SIGHTLA LALALALALALALALALALA LALALALALA
Elton John,DANIEL IS TRAVELLING TONIGHT ON A PLANEI CAN SEE THE RED TAIL LIGHTS HEADING FOR SPAINOH AND I CAN SEE DANIEL WAVING GOODBYEGOD IT LOOKS LIKE DANIEL MUST BE THE CLOUDS IN MY EYESTHEY SAY SPAIN IS PRETTY THOUGH IVE NEVER BEENWELL DANIEL SAYS ITS THE BEST PLACE THAT HES EVER SEENOH AND HE SHOULD KNOW HES BEEN THERE ENOUGHLORD I MISS DANIEL OH I MISS HIM SO MUCHOH DANIEL MY BROTHERYOU ARE OLDER THAN MEDO YOU STILL FEEL THE PAINOF THE SCARS THAT WONT HEALYOUR EYES HAVE DIEDBUT YOU SEE MORE THAN IDANIEL YOURE A STARIN THE FACE OF THE SKYOH DANIEL MY BROTHERYOU ARE OLDER THAN MEDO YOU STILL FEEL THE PAINOF THE SCARS THAT WONT HEALYOUR EYES HAVE DIEDBUT YOU SEE MORE THAN IDANIEL YOURE A STARIN THE FACE OF THE SKYDANIEL IS TRAVELLING TONIGHT ON A PLANEI CAN SEE THE RED TAIL LIGHTS HEADING FOR SPAINOH AND I CAN SEE DANIEL WAVING GOODBYEGOD IT LOOKS LIKE DANIEL MUST BE THE CLOUDS IN MY EYESOH GOD IT LOOKS LIKE DANIEL MUST BE THE CLOUDS IN MY EYES
Elton John,WHAT HAVE I GOT TO DO TO MAKE YOU LOVE MEWHAT HAVE I GOT TO DO TO MAKE YOU CAREWHAT DO I DO WHEN LIGHTNING STRIKES MEAND I WAKE TO FIND THAT YOU ARE NOT THEREWHAT DO I DO TO MAKE YOU WANT MEWHAT HAVE I GOT TO DO TO BE HEARDWHAT DO I SAY WHEN ITS ALL OVERSORRY SEEMS TO BE THE HARDEST WORDCHORUSITS SAD SO SAD SO SADITS A SAD SAD SITUATIONAND ITS GETTING MORE AND MORE ABSURDITS SAD SO SAD SO SADWHY CANT WE TALK IT OVEROH IT SEEMS TO METHAT SORRY SEEMS TO BE THE HARDEST WORDITS SAD SO SAD SO SADITS A SAD SAD SITUATIONAND ITS GETTING MORE AND MORE ABSURDITS SAD SO SAD SO SADWHY CANT WE TALK IT OVEROH IT SEEMS TO METHAT SORRY SEEMS TO BE THE HARDEST WORDWHAT DO I DO TO MAKE YOU LOVE MEWHAT HAVE I GOT TO DO TO BE HEARDWHAT DO I DO WHEN LIGHTNING STRIKES MEWHAT HAVE I GOT TO DOWHAT HAVE I GOT TO DOWHEN SORRY SEEMS TO BE THE HARDEST WORD
Elton John,HEY NIKITA IS IT COLDIN YOUR LITTLE CORNER OF THE WORLDYOU COULD ROLL AROUND THE GLOBEAND NEVER FIND A WARMER SOUL TO KNOWOH I SAW YOU BY THE WALLTEN OF YOUR TIN SOLDIERS IN A ROWWITH EYES THAT LOOKED LIKE ICE ON FIRETHE HUMAN HEART A CAPTIVE IN THE SNOWCHORUSOH NIKITA YOU WILL NEVER KNOW ANYTHING ABOUT MY HOMEILL NEVER KNOW HOW GOOD IT FEELS TO HOLD YOUNIKITA I NEED YOU SOOH NIKITA IS THE OTHER SIDE OF ANY GIVEN LINE IN TIMECOUNTING TEN TIN SOLDIERS IN A ROWOH NO NIKITA YOULL NEVER KNOWDO YOU EVER DREAM OF MEDO YOU EVER SEE THE LETTERS THAT I WRITEWHEN YOU LOOK UP THROUGH THE WIRENIKITA DO YOU COUNT THE STARS AT NIGHTAND IF THERE COMES A TIMEGUNS AND GATES NO LONGER HOLD YOU INAND IF YOURE FREE TO MAKE A CHOICEJUST LOOK TOWARDS THE WEST AND FIND A FRIENDCHORUSOH NIKITA YOU WILL NEVER KNOW ANYTHING ABOUT MY HOMEILL NEVER KNOW HOW GOOD IT FEELS TO HOLD YOUOH NO NIKITA YOUL NEVER KNOWREPEAT CHORUS
Elton John,I USED TO BE A ROLLING STONEYOU KNOW IF THE CAUSE WAS RIGHTID LEAVE TO FIND THE ANSWER ON THE ROADI USED TO BE A HEART BEATING FOR SOMEONEBUT THE TIMES HAVE CHANGEDTHE LESS I SAY THE MORE MY WORK GETS DONECAUSE I LIVE AND BREATHE THIS PHILADELPHIA FREEDOMFROM THE DAY THAT I WAS BORN IVE WAVED THE FLAGPHILADELPHIA FREEDOM TOOK ME KNEEHIGH TO A MANGAVE ME PEACE OF MIND MY DADDY NEVER HADOH PHILADELPHIA FREEDOM SHINE ON ME I LOVE YOUSHINE A LIGHT THROUGH THE EYES OF THE ONES LEFT BEHINDSHINE A LIGHT SHINE A LIGHTSHINE A LIGHT WONT YOU SHINE A LIGHTPHILADELPHIA FREEDOM I LOVE YOU YES I DOIF YOU CHOOSE TO YOU CAN LIVE YOUR LIFE ALONESOME PEOPLE CHOOSE THE CITYSOME OTHER CHOOSE THE GOOD OLD FAMILY HOMEI LIKE LIVING EASY WITHOUT FAMILY TIESTILL THE WHIPPORWILL OF FREEDOM ZAPPED MERIGHT BETWEEN THE EYESCAUSE I LIVE AND BREATHE THIS PHILADELPHIA FREEDOMFROM THE DAY THAT I WAS BORN IVE WAVED THE FLAGPHILADELPHIA FREEDOM TOOK ME KNEEHIGH TO A MANGAVE ME PEACE OF MIND MY DADDY NEVER HADOH PHILADELPHIA FREEDOM SHINE ON ME I LOVE YOUSHINE A LIGHT THROUGH THE EYES OF THE ONES LEFT BEHINDSHINE A LIGHT SHINE A LIGHTSHINE A LIGHT WONT YOU SHINE A LIGHTPHILADELPHIA FREEDOM I LOVE YOU YES I DOOH PHILADELPHIA FREEDOM SHINE ON ME I LOVE YOUSHINE A LIGHT THROUGH THE EYES OF THE ONES LEFT BEHINDSHINE A LIGHT SHINE A LIGHTSHINE A LIGHT WONT YOU SHINE A LIGHTPHILADELPHIA FREEDOM I LOVE YOU YES I DOPHILADELPHIA FREEDOM SHINE ON ME I LOVE YOUSHINE A LIGHT THROUGH THE EYES OF THE ONES LEFT BEHINDSHINE A LIGHT SHINE A LIGHTSHINE A LIGHT WONT YOU SHINE A LIGHTPHILADELPHIA FREEDOM I LOVE YOUYOU KNOW I LOVE YOU YOU KNOW I LOVE YOU YES I DOPHILADELPHIA FREEDOM I LOVE YOU YES I DOPHILA DELPHIA FREEDOM YOU KNOW THAT I LOVE YOU YES I DOPHILADELPHIA FREEDOM DONT YOU KNOW THAT I LOVE YOU YES I DOPHILA DELPHIA FREEDOM DONT YOU KNOW THT I LOVE YOU YES I DO
Elton John,PICTURE YOURSELF IN A BOAT ON A RIVERWITH TANGERINE TREES AND MARMALADE SKIESSOMEBODY CALLS YOU YOU ANSWER QUITE SLOWLYA GIRL WITH KALEIDOSCOPE EYESCELLOPHANE FLOWERS OF YELLOW AND GREENTOWERING OVER YOUR HEADLOOK FOR THE GIRL WITH THE SUN IN HER EYESAND SHES GONELUCY IN THE SKY WITH DIAMONDSLUCY IN THE SKY WITH DIAMONDSLUCY IN THE SKY WITH DIAMONDSAAAAAAHFOLLOW HER DOWN TO A BRIDGE BY A FOUNTAINWHERE ROCKING HORSE PEOPLE EAT MARSHMALLOW PIESEVERYONE SMILES AS YOU DRIFT PAST THE FLOWERSTHAT GROW SO INCREDIBLY HIGHNEWSPAPER TAXIS APPEAR ON THE SHOREWAITING TO TAKE YOU AWAYCLIMB IN THE BACK WITH YOUR HEAD IN THE CLOUDSAND YOURE GONELUCY IN THE SKY WITH DIAMONDSLUCY IN THE SKY WITH DIAMONDSLUCY IN THE SKY WITH DIAMONDSAAAAAAHPICTURE YOURSELF ON A TRAIN IN A STATIONWITH PLASTICINE PORTERS WITH LOOKING GLASS TIESSUDDENLY SOMEONE IS THERE AT THE TURNSTILETHE GIRL WITH KALEIDOSCOPE EYESLUCY IN THE SKY WITH DIAMONDSLUCY IN THE SKY WITH DIAMONDSLUCY IN THE SKY WITH DIAMONDSAAAAAAHLUCY IN THE SKY WITH DIAMONDSLUCY IN THE SKY WITH DIAMONDSLUCY IN THE SKY WITH DIAMONDSAAAAAAHLUCY IN THE SKY WITH DIAMONDSLUCY IN THE SKY WITH DIAMONDSLUCY IN THE SKY WITH DIAMONDS
Elton John,EVER SINCE I WAS A YOUNG BOY I PLAYED THE SILVER BALLFROM SOHO DOWN TO BRIGHTON I MUST HAVE PLAYED EM ALLBUT I AINT SEEN NOTHIN LIKE HIM IN ANY AMUSEMENT HALLTHAT DEAF DUMB AND BLIND KID SURE PLAYS A MEAN PINBALLHE STANDS LIKE A STATUE BECOMES PART OF THE MACHINEFEELIN ALL THE BUMPERS ALWAYS PLAYIN CLEANHE PLAYS BY INTUITION THE DIGIT COUNTERS FALLTHAT DEAF DUMB AND BLIND KID SURE PLAYS A MEAN PINBALLHES A PINBALL WIZARD THERE HAS TO BE A TWISTA PINBALL WIZARDS GOT SUCH A SUPPLE WRISTHOW DO YOU THINK HE DOES IT I DONT KNOWWHAT MAKES HIM SO GOODWELL HE AINT GOT NO DISTRACTIONS CANT HEAR NO BUZZES OR BELLSDONT SEE NO LIGHTS AFLASHIN HE PLAYS BY SENSE OF SMELLALWAYS HAVE A REPLAY NEVER TILTS AT ALLTHAT DEAF DUMB AND BLIND KID SURE PLAYS A MEAN PINBALLHE CANT BEAT ME NOW IVE ALWAYS BEEN THE CHAMPI KNOW EVERY TRICK NO FREAKS GONNA BEAT MY HANDEVEN ON MY USUAL TABLE HE CAN BEAT THE BESTHIS DISCIPLES LEAD HIM IN AND HE JUST DOES THE RESTHES GOT CRAZY FLIPPER FINGERS IVE NEVER SEEN HIM FALLTHAT DEAF DUMB AND BLIND KID SURE PLAYS A MEAN PINBALLHES A PINBALL WIZARD THERE HAS TO BE A TWISTA PINBALL WIZARDS GOT SUCH A SUPPLE WRISTHES A PINBALL WIZARD HE SCORES A TRILLION MOREA PINBALL WIZARD THE WORLDS NEW PINBALL LORDHES SCORING MORE HES SCORING MOREI THOUGHT I WAS THE BALLY TABLE KINGBUT I JUST HANDED MY PINBALL CROWN TO HIMTO HIM TO HIM
Elton John,I WAS JUSTIFIED WHEN I WAS FIVERAISING CAIN I SPIT IN YOUR EYETIMES ARE CHANGING NOW THE POOR GET FATBUT THE FEVERS GONNA CATCH YOU WHEN THE BITCH GETS BACKEAT MEAT ON FRIDAY THATS ALRIGHTEVEN LIKE STEAK ON A SATURDAY NIGHTI CAN BITCH THE BEST AT YOUR SOCIAL DOSI GET HIGH IN THE EVENING SNIFFING POTS OF GLUEIM A BITCH IM A BITCHOH THE BITCH IS BACKSTONE COLD SOBER AS A MATTER OF FACTI CAN BITCH I CAN BITCHCAUSE IM BETTER THAN YOUITS THE WAY THAT I MOVETHE THINGS THAT I DOI ENTERTAIN BY PICKING BRAINSSELL MY SOUL BY DROPPING NAMESI DONT LIKE THOSE MY GOD WHATS THATOH ITS FULL OF NASTY HABITS WHEN THE BITCH GETS BACK
Elton John,WHEN I LOOK BACKBOY I MUST HAVE BEEN GREENBOPPIN IN THE COUNTRYFISHIN IN A STREAMLOOKIN FOR AN ANSWERTRYIN TO FIND A SIGNUNTIL I SAW YOUR CITY LIGHTSHONEY I WAS BLINDTHEY SAID GET BACK HONKY CATBETTER GET BACK TO THE WOODSWELL I QUIT THOSE DAYS AND MY REDNECK WAYSAND OH OH OH OH THE CHANGE IS GONNA DO ME GOODYOU BETTER GET BACK HONKY CATLIVIN IN THE CITY AINT WHERE ITS ATITS LIKE TRYIN TO FIND GOLD IN A SILVER MINEITS LIKE TRYIN TO DRINK WHISKY FROM A BOTTLE OF WINEWELL I READ SOME BOOKS AND I READ SOME MAGAZINESABOUT THOSE HIGH CLASS LADIESDOWN IN NEW ORLEANSAND ALL THE FOLKS BACK HOME WELL THEY SAID I WAS A FOOLTHEY SAID OH BELIEVE IN THE LORDIS THE GOLDEN RULETHEY SAID STAY AT HOME BOY YOU GOTTA TEND THE FARMLIVIN IN THE CITY BOYIS GONNA BREAK YOUR HEARTBUT HOW CAN YOU STAY WHEN YOUR HEART SAYS NOHOW CAN YOU STOP WHEN YOUR FEET SAY GO
Elton John,IF YOU FEEL THAT ITS REAL IM ON TRIALAND IM HERE IN YOUR PRISONLIKE A COIN IN YOUR MINTI AM DENTED AND IM SPENT WITH HIGH TREASONTHROUGH A GLASS EYE YOUR THRONEIS THE ONE DANGER ZONETAKE ME TO THE PILOT FOR CONTROLTAKE ME TO THE PILOT OF YOUR SOULTAKE ME TO THE PILOTLEAD ME THROUGH THE CHAMBERTAKE ME TO THE PILOTI AM BUT A STRANGERTAKE ME TO THE PILOTLEAD ME THROUGH THE CHAMBERTAKE ME TO THE PILOTI AM BUT A STRANGERWELL I KNOW HES NOT OLDAND IM TOLD HES A VIRGINFOR HE MAY BE SHEBUT WHAT IM TOLD IS NEVER FOR CERTAIN
